IDInstituicao,NomeInstituicao,SiglaInstituicao,NomeMantenedora,RedeEnsino,TipoDeCategoriaAdministrativa,TIpoOrganizacaoAcademica,Endereco,NumEndereco,BairroEndereco,ComplementoEndereco,CEP
4598,FACULDADE SANTA CASA DE BELO HORIZONTE,FSCBH,SANTA CASA DE MISERICORDIA DE BELO HORIZONTE,Privada,5,3,Rua Domingos Vieira,416,Santa Efigênia,-,30260070.0
4599,Faculdades Integradas Padrão,FIP GUANAMBI,SOCIEDADE PADRAO DE EDUCACAO SUPERIOR LTDA,Privada,4,3,Avenida Prisco Viana,215,Santa Catarina,-,46430000.0
4600,Faculdade de Miguel Pereira,FAMIPE,FUNDACAO EDUCACIONAL SEVERINO SOMBRA,Privada,5,3,Rua Avarenga Peixoto,111,Vila Selma,-,26900000.0
4601,Faculdade de Ciências Médicas de Três Rios,FCM/TR,SUPREMA-SOCIEDADE UNIVERSITARIA PARA O ENSINO MEDICO ASSISTENCIAL LTDA,Privada,4,3,Rua Isaltino Silveira,1470,Cantagalo,-,25804250.0
4602,Faculdade de Ciências Jurídicas de Arapiraca,,EDITORA E DISTRIBUIDORA EDUCACIONAL S/A,Privada,4,3,Rua Professor Domingos Correia,1461,Ouro Preto,- de 800/801 a 1263/1264,57301100.0
4603,Faculdade de Ciências Jurídicas de Brumado,,EDITORA E DISTRIBUIDORA EDUCACIONAL S/A,Privada,4,3,Rua Eugênia Dantas Araujo,55,Hospital,-,46100000.0
4604,Faculdade de Ciências Jurídicas de Bom Jesus da Lapa,,EDITORA E DISTRIBUIDORA EDUCACIONAL S/A,Privada,4,3,Primeira Travessa do Aeroporto,28,Consolação,-,47600000.0
4605,Faculdade de Ciências Jurídicas de Campina Grande,,EDITORA E DISTRIBUIDORA EDUCACIONAL S/A,Privada,4,3,Rua Marquês do Herval,39,Centro,-,58400208.0
4606,CENTRO DE ENSINO SUPERIOR DO TOCANTINS,,"INSTITUTO EURO-AMERICANO DE EDUCACAO, CIENCIA E TECNOLOGIA S.A.",Privada,5,3,Quadra 1102 Sul Avenida Joaquim Teotônio Segurado,s/n,Plano Diretor Sul,"Conjunto 1, Lotes 01 e 02",77024002.0
4607,Faculdade de Ciências Jurídicas de Jaboatão dos Guararapes,,EDITORA E DISTRIBUIDORA EDUCACIONAL S/A,Privada,4,3,Rua Aurora Diniz Carneiro Leão,5281,Candeias,-,54440072.0
4608,Faculdade de Ciências Jurídicas de Luziânia,,EDITORA E DISTRIBUIDORA EDUCACIONAL S/A,Privada,4,3,Rua Bate Couro,425,Rosário,-,72812040.0
4609,Faculdade de Ciências Jurídicas de Erechim,,EDITORA E DISTRIBUIDORA EDUCACIONAL S/A,Privada,4,3,Avenida XV de Novembro,237,Centro,-,99700306.0
4610,Faculdade de Ciências Jurídicas de Jaú,,EDITORA E DISTRIBUIDORA EDUCACIONAL S/A,Privada,4,3,Travessa Coronel Ricardo Auler,551,Vila Assis,-,17210200.0
4611,Faculdade de Ciências Jurídicas de Belo Jardim,,EDITORA E DISTRIBUIDORA EDUCACIONAL S/A,Privada,4,3,Rua Doutor Henrique Nascimento,41,São Pedro,-,55155580.0
4612,FACULDADE REGIONAL DE MINAS GERAIS,FACMINAS,INSTITUTO DE EDUCACAO TECNOLOGICA LTDA - ME,Privada,4,3,Rua Aparício Gomes,100,centro,-,39875000.0
4613,Faculdade  São Joaquim da Barra,,FUNDACAO EDUCACIONAL DE ITUVERAVA,Privada,5,3,Rua Rio Grande do Norte,1470,Centro,-,14600000.0
4614,Faculdade ENAU,FacEnau,ENAU EDUCACIONAL LTDA - EPP,Privada,4,3,Rua Doutor Jorge Tibiriçá,124,Centro Alto,-,9424130.0
4615,Faculdade União Paulistana,FAUP,FAUP - FACULDADE UNIAO PAULISTANA LTDA - ME,Privada,4,3,Rua Galeno de Castro,93,Jurubatuba,-,4696040.0
4616,Faculdade Estácio de Jaraguá do Sul,Estácio Jaraguá,SOCIEDADE DE ENSINO SUPERIOR ESTACIO DE SA LTDA,Privada,4,3,Rua Germano Stricker,555,Tifa Monos,-,89265100.0
4617,Faculdade Serra Dourada,,SOCIEDADE EDUCACIONAL SANTO ANTONIO LTDA,Privada,4,3,Avenida Novo Horizonte,214,Residencial Cidade Nova,-,68378001.0
4618,FACULDADE ATENAS SETE LAGOAS,,CENTRO EDUCACIONAL HYARTE-ML LTDA,Privada,4,3,Avenida Prefeito Alberto Moura,6000,Nova Cidade,- de 04201/4202 a 6399/06400,35702272.0
4619,Instituto Serra Dourada,,SOCIEDADE EDUCACIONAL SANTO ANTONIO LTDA,Privada,4,3,Avenida Novo Horizonte,214,Residencial Cidade Nova,-,68378001.0
4620,Faculdade de Direito Serra Dourada,,SOCIEDADE EDUCACIONAL SANTO ANTONIO LTDA,Privada,4,3,Avenida Novo Horizonte,214,Residencial Cidade Nova,-,68378001.0
4621,FACULDADE ATENAS PASSOS,,CENTRO EDUCACIONAL HYARTE-ML LTDA,Privada,4,3,Oscar Cândido Monteiro,1000,Jardim Colégio de Passos,-,37900380.0
4622,Faculdade Estácio de Juazeiro,EstácioJuazeiro,"IREP SOCIEDADE DE ENSINO SUPERIOR, MEDIO E FUNDAMENTAL LTDA.",Privada,4,3,"Rodovia BR 407, s/n°, Lotes 10-57 e 69-100, Km 13",-,Distrito Industrial,-,48909725.0
4623,Faculdade de Matupá,UNIFAMA,UNIFAMA - UNIAO DAS FACULDADES DE MATO GROSSO LTDA,Privada,4,3,Avenida,0,Zona Especial (ZE) 009,-,78525000.0
4624,FACULDADE UNAMA DE CASTANHAL,UNAMA CASTANHAL,INSTITUTO CAMPINENSE DE ENSINO SUPERIOR LTDA,Privada,4,3,Avenida Presidente Getúlio Vargas,4257,Ianetama,- de 3098/3099 ao fim,68745000.0
4625,Faculdade de Ciências Jurídicas de Altamira,,PITAGORAS - SISTEMA DE EDUCACAO SUPERIOR SOCIEDADE LTDA,Privada,4,3,Avenida Tancredo Neves,3414,Jardim Independente II,- de 3008/3009 ao fim,68372222.0
4626,Faculdade de Ciências Jurídicas de Assis,,ANHANGUERA EDUCACIONAL PARTICIPACOES S/A,Privada,4,3,Rua Josino de Andrade,"267, 277",Centro,- até 340/341,19800290.0
4627,FACULDADE  INTEGRADA DE ADVOCACIA DA  AMAZÔNIA,FINAMA,F. P. DO NASCIMENTO - ME,Privada,4,3,Avenida Conselheiro Furtado,2499,Cremação,- de 2398/2399 a 3319/3320,66063060.0
4628,FACULDADE DO CARIRI PARAIBANO,UNICIR,UNICIR - FACULDADE DO CARIRI LTDA - EPP,Privada,4,3,BR 412,KM 105,Sítio Novo Oriente,-,58540000.0
4629,"Faculdade do Amazonas de Ensino, Pesquisa e Inovação",FAMEPI,DIGITRON DA AMAZONIA INDUSTRIA E COMERCIO S. A.,Privada,4,3,Avenida Ministro Mário Andreazza,916,Distrito Industrial I,-,69075830.0
4630,FACULDADE SUCESSO,FACSU,SUCESSO PUBLICA  ES E ASSESSORIA LTDA  - ME,Privada,4,3,AVENIDA PREFEITO PEDRO EULÂMPIO DA SILVA,3086,SÃO JOSÉ,-,58865000.0
4631,Faculdade de Direito AVANTIS de Itapema,AVANTIS Itapema,SOCIEDADE AVANTIS DE ENSINO E ESCOLA DE AVIACAO CIVIL S.A.,Privada,4,3,Av. Nereu Ramos,3.977,Meia Praia,-,88220000.0
4632,Faculdade de Palmeiras de Goiás - FacMais,FacMais,CENTRO DE EDUCACAO SUPERIOR MAIS EIRELI,Privada,4,3,"Rua 3, Qd. 29, Lt 1-C",s/n,Residencial Flórida,-,76190000.0
4633,FACULDADE VANGUARDA,,FACULDADE VANGUARDA LTDA,Privada,4,3,Avenida Engenheiro Francisco José Longo,520,Jardim São Dimas,Faculdade Vanguarda,12245001.0
4634,Instituto de Desenvolvimento Tecnológico da FGV,FGV/IDT,FUNDACAO GETULIO VARGAS,Privada,5,3,Rua Jornalista Orlando Dantas,30,Botafogo,-,22231010.0
4635,FACULDADE NOVE DE JULHO DE OSASCO,NOVE-OSASCO,ASSOCIACAO EDUCACIONAL NOVE DE JULHO,Privada,5,3,Rua Dante Battiston,107,Centro,-,6013030.0
4636,FACULDADE NOVE DE JULHO DE BAURU,NOVE-BAURU,ASSOCIACAO EDUCACIONAL NOVE DE JULHO,Privada,5,3,Rua Nicolau Assis,Quadra 7,Jardim Panorama,"nºs 1, 15, 21, 27, 35, 41, 46, 51",17011102.0
4637,FACULDADE NOVE DE JULHO GUARULHOS,NOVE-GUARULHOS,ASSOCIACAO EDUCACIONAL NOVE DE JULHO,Privada,5,3,Rua Harry Simonsen,21,Vila das Palmeiras,-,7013110.0
4638,FACULDADE NOVE DE JULHO MAUÁ,NOVE_MAUÁ,ASSOCIACAO EDUCACIONAL NOVE DE JULHO,Privada,5,3,Rua Álvares Machado,48,Vila Bocaina,-,9310020.0
4639,Escola Superior da Amazônia de Abaetetuba,ESAMAZ,FACULDADES INTEGRADAS CARAJAS S/C LTDA - EPP,Privada,4,3,Av. Lauro Sodré,560,Centro,-,68440000.0
4640,Faculdade de Tecnologia de Itatiba,Fatec Itatiba,CENTRO ESTADUAL DE EDUCACAO TECNOLOGICA PAULA SOUZA,Pública,2,3,Rua Daniel Peçanha de Moraes,220,Jardim Salessi,-,13251140.0
4641,Faculdade Brasília,FBr,UP10 EDUCACIONAL LTDA,Privada,4,3,"Avenida Santa Maria, Comércio Local 417",Lote E,Santa Maria,-,72547240.0
4642,FACULDADE UNIRB - MACEIO,Faculdade Unirb,UNIRB - UNIVERSIDADE REGIONAL BRASILEIRA S.A.,Privada,4,3,Avenida Menino Marcelo,7600,Serraria,Unirb,57046000.0
4643,FACULDADE Ensin.E,ENSIN.E,ENSIN.E EDUCACAO LTDA,Privada,4,3,Avenida Barão do Rio Branco,3580,Passos,FACULDADE ENSIN.E,36025020.0
4644,Faculdade Alfredo Nasser de Casa Nova,FAN,ASSOCIACAO APARECIDENSE DE EDUCACAO,Privada,5,3,"BR 235, Km 70 - Zona Urbana",S/N,Zona Urbana,-,47300000.0
4645,FGW - Faculdade de Gestão WOLI,WOLI,INSTITUTO EDUCACIONAL WOLI LTDA,Privada,4,3,Avenida João Moreira Sales,690,Arasol,-,38182264.0
4646,FACULDADE REALIZA,,REALIZA COMPLEXO EDUCACIONAL EIRELI,Privada,4,3,Avenida Lago das Garças,S/N,Jardim Tropical,Qd.26 Lt. 31,74946505.0
4647,FACULDADE UNIRB - CIDADE DE FORTALEZA,F. UNIRB,UNIDADE REGIONAL BRASILEIRA DE EDUCACAO LTDA,Privada,4,3,Avenida João Pessoa,3884,Damas,DAMAS,60425812.0
4648,FACULDADE ARQUIDIOCESANA DE PIRAPORA,FAP,MITRA ARQUIDIOCESANA DE DIAMANTINA,Privada,5,3,Rua Otávio Carneiro,652,Santo Antônio,-,39270000.0
4649,FACULDADE TIRADENTES DE JABOATÃO DOS GUARARAPES,,SOCIEDADE DE EDUCACAO TIRADENTES S.A,Privada,4,3,Avenida General Barreto de Menezes,738,Cajueiro Seco - Piedade,- de 1 a 99999 - lado ímpar,54330000.0
4650,Faculdade Cleber Leite,FCL,PROFESSOR DR. CLEBER LEITE EDUCACAO E PESQUISA LTDA - ME,Privada,4,3,Rua Coronel Seabra,395,Vila Marina,-,9090401.0
4651,FACULDADE CENSUPEG,,"SOCIEDADE DE EDUCACAO, CULTURA E TECNOLOGIA SAO FIDELIS LTDA - EPP",Privada,4,3,Rua do Príncipe,796,Centro,CENSUPEG JOINVILLE-SC,89201001.0
4652,FACULDADES INTEGRADAS DA AMÉRICA DO SUL,FAC INTEGRA,FACULDADES INTEGRADAS DA AMERICA DO SUL LTDA - EPP,Privada,4,3,Rua Presidente Geisel,S/N,Setor Lagoa Quente,-,75692532.0
4653,FACULDADE CECAPE,,CECAP - CENTRO CARIRIENSE DE POS-GRADUACAO LTDA - ME,Privada,4,3,Rua Sulino Duda,113,Triângulo,-,63041185.0
4654,Faculdade Zona Leste,FZL,FACULDADE ZONA LESTE LTDA,Privada,4,3,Rua Platina,570,Vila Azevedo,-,3308010.0
4655,Faculdade Alvorada de Saúde,,CENTRO EDUCACIONAL ALVORADA LTDA,Privada,4,3,Rua Ulisses Cruz,285,Tatuapé,Primeiro Andar,3077000.0
4656,Faculdade Damásio,Damásio,DAMASIO EDUCACIONAL S.A.,Privada,4,3,Rua da Glória,195,Liberdade,Faculdade Damásio,1510000.0
4657,CLARETIANO - FACULDADE DE BOA VISTA,CLARETIANOBV,ACAO EDUCACIONAL CLARETIANA,Privada,5,3,Rua Antônio Augusto Martins,52,São Francisco,Prédio Institucional,69305270.0
4658,FACULDADE FASIPE DE RONDONÓPOLIS,FFR,UNIAO DAS FACULDADES FASIPE LTDA,Privada,4,3,Avenida Angêlo Thum,17,Jardim Monte Líbano,-,78710272.0
4659,Faculdade São Francisco Xavier,FACSFX,FUNDACAO EDUCACIONAL SAO FRANCISCO XAVIER,Privada,5,3,Avenida Itália,1910,Cariru,- de 1047/1048 a 2047/2048,35160114.0
4660,Faculdade de Ciências Sociais e Tecnologia,FACISTEC,CENTRO DE EDUCACAO E TECNOLOGIA UNICENTRAL LTDA - ME,Privada,4,3,Rua Marino Cattani,477,Campo Real,-,78840000.0
4661,FACULDADE PITÁGORAS UNOPAR DE ITAJUBÁ,,PITAGORAS - SISTEMA DE EDUCACAO SUPERIOR SOCIEDADE LTDA,Privada,4,3,Rua Doutor Xavier Lisboa,348,Varginha,-,37501042.0
4662,FACULDADE PITÁGORAS UNOPAR DE QUIXERAMOBIM,,PITAGORAS - SISTEMA DE EDUCACAO SUPERIOR SOCIEDADE LTDA,Privada,4,3,RUA DR. MONTEIRO FILHO,130,Centro,-,63800000.0
4663,FACULDADE DO OESTE POTIGUAR,FAOP,CENTRO DE EDUCACAO SUPERIOR E TECNOLOGICO OESTE POTIGUAR LTDA - ME,Privada,4,3,RUA VEREADOR SALOMÃO QUEIROZ,151,CENTRO,RUA FRANCISCA BOBO - 451,59920000.0
4664,FACULDADE PITÁGORAS UNOPAR DE CANINDÉ,,PITAGORAS - SISTEMA DE EDUCACAO SUPERIOR SOCIEDADE LTDA,Privada,4,3,RUA TABELIÃO FACUNDO,"393, 395 E 395",centro,-,62700000.0
4665,Faculdade SOCIESC de Itajaí,SOCIESC,SOCIEDADE DE EDUCACAO SUPERIOR E CULTURA BRASIL S.A.,Privada,4,3,Rua Brusque,162,Centro,- até 460 - lado par,88303000.0
4666,FACULDADE MASTER DO PARÁ - FAMAP XINGUARA,FAMAP,SOCIEDADE DE ENSINO SUPERIOR MASTER S/S LTDA. - ME,Privada,4,3,Rua Sol Nascente,S/N,Tanaka,SETOR MARIAZINHA,68556110.0
4667,Faculdade Una de Itabira,Una,BRASIL EDUCACAO S/A,Privada,4,3,Rua Sizenando de Barros,27,Centro,-,35900006.0
4668,Faculdade Fleming Cerquilho,Fac Cerquilho,A. FLEMING EDUCACIONAL LTDA,Privada,4,3,Avenida Prefeito Antônio Souto,191,Jardim Itália,-,18520000.0
4669,ESCOLA SUPERIOR DE EDUCAÇÃO,ESJUS,ESJUS - ESCOLA SUPERIOR DE JUSTICA LTDA - ME,Privada,4,3,Avenida Miguel Perrela,-,Castelo,-,31330290.0
4670,Faculdade Auden Educacional,FAED,AUDEN EDUCACAO LTDA,Privada,4,3,Avenida Angélica,341,Santa Cecília,- até 955 - lado ímpar,1311000.0
4671,FranklinCovey Business School,FCBS,FRANKLINCOVEY EDUCACAO E EDITORA LTDA - ME,Privada,4,3,Rua Flórida,1568,Cidade Monções,- de 1001/1002 ao fim,4565001.0
4672,FACULDADE DE CIÊNCIAS MÉDICAS DE MARICÁ,,FUNDACAO EDUCACIONAL SEVERINO SOMBRA,Privada,5,3,Avenida Roberto da Silveira,437,Centro,- até 617 - lado ímpar,24900440.0
4673,Faculdade de Tecnologia de Araraquara,FATEC ARQ,CENTRO ESTADUAL DE EDUCACAO TECNOLOGICA PAULA SOUZA,Pública,2,3,Rua Precide Scarpino Martim,126,Jardim Santa Clara (Vila Xavier),-,14811373.0
4674,UNICORP FACULDADES,UNICORP,CENTRO INTEGRADO DE EDUCACAO LTDA - ME,Privada,4,3,Rua João Amorim,256,Centro,-,58013310.0
4675,Escola de Sargentos de Logística,EsSLog,COMANDO DO EXERCITO,Pública,1,3,Rua João Vicente,2179,Deodoro,- de 2150/2151 ao fim,21610211.0
4676,Escola de Sargentos das Armas,ESA,COMANDO DO EXERCITO,Pública,1,3,avenida sete de setembro,628,centro,-,37410000.0
4677,FACULDADE DE NOVA MUTUM,,IES-INSTITUICAO DE ENSINO SUPERIOR NOVA MUTUM LTDA,Privada,4,3,AVENIDA DAS GARÇAS,1121,BAIRRO DAS ORQUIDEAS,-,78450000.0
4678,Instituto SOCIESC de Jaraguá do Sul,SOCIESC,IEDUC - INSTITUTO DE EDUCACAO E CULTURA S/A,Privada,4,3,Avenida Getúlio Vargas,268,Centro,-,89251000.0
4679,Faculdade Dom Adelio Tomasin,FADAT,INSTITUTO EDUCACIONAL E DE DESENVOLVIMENTO PROFISSIONAL SAO JOAO PAULO II LTDA,Privada,4,3,Avenida Avenida Plácido Castelo,4773,São João,Antiga estrada de terra que liga Quixadá a Baturite,63900403.0
4680,Instituto de Desenvolvimento e Aprendizagem - IDEA São Luiz,IDEA São Luiz,IDEA - INSTITUTO DE DESENVOLVIMENTO E APRENDIZAGEM SERVICOS EDUCACIONAIS LTDA,Privada,4,3,Avenida Dois,33,Alterosa,Quadra S,65073139.0
4681,Faculdade do Comércio de São Paulo,FAC-SP,INSTITUTO PAULISTANO DE ENSINO SUPERIOR DO COMERCIO S.A,Privada,4,3,Associação Comercial de São Paulo,51,Centro,"Rua Boa Vista nº 51 - 1º, 2º, 3º e 7º andar",1014911.0
4682,FACULDADE EDUCAR DA IBIAPABA,FAEDI,INSTITUTO DE EDUCACAO EDUCAR EIRELI  - ME,Privada,4,3,"CE-187, KM 231",sn,Bairro MINA,-,62250000.0
4683,Centro de Ensino Superior de Contagem,,IEDUC - INSTITUTO DE EDUCACAO E CULTURA S/A,Privada,4,3,Avenida João César de Oliveira,5775,Beatriz,- de 5000/5001 ao fim,32040000.0
4684,Centro de Ensino Superior de Divinópolis,,IEDUC - INSTITUTO DE EDUCACAO E CULTURA S/A,Privada,4,3,Rua Coronel João Notini,151,Centro,- até 1507/1508,35500017.0
4685,Escola Superior de Itabira,,FACEB EDUCACAO LTDA,Privada,4,3,Rua Sizenando de Barros,27,Centro,-,35900006.0
4686,Centro de Ensino Superior de Nova Serrana,,IEDUC - INSTITUTO DE EDUCACAO E CULTURA S/A,Privada,4,3,BR 262 - KM 448,s/nº,Anexo Distrito Industrial José Silva de Almeida,-,35519000.0
4687,Escola Superior de Pouso Alegre,,FACEB EDUCACAO LTDA,Privada,4,3,Rua João Basílio,420,Centro,-,37550000.0
4688,Faculdade de Educação Superior de Sete Lagoas,,BRASIL EDUCACAO S/A,Privada,4,3,Avenida Secretário Divino Padrão,1411,Santo Antônio,A,35702075.0
4689,Faculdade de Educação Superior de Catalão,,BRASIL EDUCACAO S/A,Privada,4,3,Rua Ademar Ferrugem,840,Santo Antônio,-,75701655.0
4690,Centro de Ensino Superior de Sete Lagoas,,IEDUC - INSTITUTO DE EDUCACAO E CULTURA S/A,Privada,4,3,Avenida Secretário Divino Padrão,1411,Santo Antônio,A,35702075.0
4691,Escola Superior de Catalão,,FACEB EDUCACAO LTDA,Privada,4,3,Rua Ademar Ferrugem,840,Santo Antônio,-,75701655.0
4692,Faculdade Central do Recife Centro,FACENTRAL REC,CENTRO DE ESTUDOS ACADEMICOS DO RECIFE EIRELI,Privada,4,3,Rua Velha,34 A,Boa Vista,-,50060210.0
4693,Faculdade PSICOLOG,FAPSI,PSICOLOG - INSTITUTO DE ESTUDOS DO COMPORTAMENTO LTDA,Privada,4,3,Rua Júlio Prestes,959,Jardim Sumaré,-,14025060.0
4694,Centro de Ensino Superior SOCIESC de Itajaí,,IEDUC - INSTITUTO DE EDUCACAO E CULTURA S/A,Privada,4,3,Rua Brusque,162,Centro,- até 460 - lado par,88303000.0
4695,Faculdade SOCIESC de Educação de São Bento do Sul,,BRASIL EDUCACAO S/A,Privada,4,3,Rua Doutor Hans Dieter Schmidt,879,Centenário,-,89283105.0
4696,Faculdade Alfredo Nasser de Pontalina,,ASSOCIACAO APARECIDENSE DE EDUCACAO,Privada,5,3,Avenida Sao Benedito,900,Jardim Frei Walter,-,75620000.0
4697,Instituto Universitário São Judas de São Bernardo do Campo,,BRASIL EDUCACAO S/A,Privada,4,3,Avenida Pereira Barreto,1479,Centro/Baeta Neves,-,9751000.0
4698,Faculdade de Agronomia UNA de Conselheiro Lafaiete,,FACEB EDUCACAO LTDA,Privada,4,3,Avenida Professor Mário Rodrigues Pereira,157,Jardim América,-,36400107.0
4699,FACULDADE BRASILEIRA DE CACHOEIRO,,EMPRESA BRASILEIRA DE ENSINO PESQUISA E EXTENSAO S/A - MULTIVIX,Privada,4,3,Rodovia Engenheiro Fabiano Vivácqua,2531,Monte Belo,Faculdade Brasileira de Cachoeiro,29314803.0
4700,Centro de Ensino Superior SOCIESC de Jaraguá do Sul,,BRASIL EDUCACAO S/A,Privada,4,3,Avenida Getúlio Vargas,268,Centro,Garden Shopping Center,89251000.0
4701,Faculdade UNINORTE Tailândia,UNINORTE,FACULDADE UNIAO EDUCACIONAL NORTE DO PARA LTDA  - ME,Privada,4,3,Travessa Altamira,6,Novo,-,68695000.0
4702,UNIVERSIDADE ESTADUAL DA REGIÃO TOCANTINA DO MARANHÃO,UEMASUL,UNIVERSIDADE ESTADUAL DA REGIAO TOCANTINA DO MARANHAO,Pública,2,1,Rua Godofredo Viana,1300,Centro,-,65901480.0
4703,Faculdade de Tecnologia de Araras,,CENTRO ESTADUAL DE EDUCACAO TECNOLOGICA PAULA SOUZA,Pública,2,3,Rua Jarbas Leme de Godoy,875,Jardim José Ometto II,- de 812 a 1740 - lado par,13606389.0
4704,FACULDADE IMEPAC DE ITUMBIARA,IMEPAC ITUMBIAR,INSTITUTO DE ADMINISTRACAO & GESTAO EDUCACIONAL LTDA,Privada,4,3,Avenida Adelina Alves Vilela,393,Residencial Jardim Primavera,Quadra 28 A,75524500.0
4705,Faculdade de Tecnologia de Adamantina,,CENTRO ESTADUAL DE EDUCACAO TECNOLOGICA PAULA SOUZA,Pública,2,3,Rua Paraná,400,Jardim Brasil,-,17800000.0
4706,Faculdade de Tecnologia de Ferraz de Vasconcelos,,CENTRO ESTADUAL DE EDUCACAO TECNOLOGICA PAULA SOUZA,Pública,2,3,Rua Carlos de Carvalho,200,Jardim São João,Fatec Ferraz de Vasconcelos,8545120.0
4707,Faculdade de Educação Tecnológica Barra Mansa,FAETERJ B.MANSA,FUNDACAO DE APOIO A ESCOLA TECNICA DO EST.RIO DE JANEIRO,Pública,2,3,Via Sérgio Braga,s/n,Barbara,- de 1219 ao fim - lado ímpar,27330051.0
4708,Escola Superior de Gestão,ESGe,FUNDACAO UNIVERSIDADE ABERTA DO DISTRITO FEDERAL,Pública,2,3,Quadra SGO Quadra 1,1,Setores Complementares,-,70610610.0
4709,FACULDADE DESCOMPLICA,,DESCOMPLICA TECNOLOGIA E EDUCACAO S.A.,Privada,4,3,Avenida das Américas,3443,Barra da Tijuca,- até 2211 - lado ímpar,22631000.0
4710,Faculdade de Tecnologia de Sumaré,Fatec de Sumaré,CENTRO ESTADUAL DE EDUCACAO TECNOLOGICA PAULA SOUZA,Pública,2,3,Rua Ipiranga,73,Centro,-,13170026.0
4711,Link School of Business,LSB,BRAVIA EDUCACAO HOLDING S.A.,Privada,4,3,Avenida Brigadeiro Luís Antônio,4980,Jardim Paulista,- de 4100 ao fim - lado par,1402002.0
4712,Faculdade de Nova Mutum,UNIFAMA,UNIFAMA - UNIAO DAS FACULDADES DE MATO GROSSO LTDA,Privada,4,3,Avenida dos Canários,155 a 191 S,Loteamento José Aparecido Ribeiro,"Quadra B, Lotes 11, 12 e 13 e Complementos",78450000.0
4713,Faculdade AGES de Medicina de Irecê,Faculdade AGES,AGES EMPREENDIMENTOS EDUCACIONAIS LTDA,Privada,4,3,Rua Dr. Angelo Dourado,27,Centro,"Prédio Anexo: Praça Goes Calmon, 33",44900000.0
4714,CENTRO DE EDUCAÇÃO TECNOLÓGICO DA FUNDAÇÃO INDAIATUBANA DE EDUCAÇÃO E CULTURA,FIEC,FIEC FUNDACAO INDAIATUBANA DE EDUCACAO E CULTURA,Pública,3,3,Avenida Engenheiro Fábio Roberto Barnabé,-,Jardim Regina,-,13349003.0
4715,Faculdade de Medicina do Sertão,FMS,SOCIEDADE REGIONAL DE ENSINO E SAUDE S/S LTDA,Privada,4,3,Avenida Osvaldo Cruz,10.017,São Cristóvão,"BR 232, km 270",56512670.0
4716,Faculdade UNICESUMAR de Corumbá,,CESUMAR - CENTRO DE ENSINO SUPERIOR DE MARINGA LTDA,Privada,4,3,Rua Dom Aquino,1037,Centro,- de 0823/824 a 1117/1118,79300050.0
4717,FACULDADE ESTÁCIO DE CANINDÉ,ESTÁCIO CANINDÉ,UB UNISAOLUIS EDUCACIONAL S.A,Privada,4,3,RODOVIA CE020,20,ZONA URBANA,-,62700000.0
4718,FACULDADE ITPAC SANTA INES,ITPAC SANTA INÊS,IPTAN - INSTITUTO DE ENSINO SUPERIOR PRESIDENTE TANCREDO DE ALMEIDA NEVES S.A.,Privada,4,3,CONTORNO DA BR 316,346,VILA OLIMPICA,-,65304770.0
4719,FACULDADE DE TECNOLOGIA DE MATÃO,,CENTRO ESTADUAL DE EDUCACAO TECNOLOGICA PAULA SOUZA,Pública,2,3,Avenida Habib Gabriel,1360,Residencial das Acácias,-,15990539.0
4720,UNIVERSIDADE FEDERAL DE CATALÃO,UFCAT,UNIVERSIDADE FEDERAL DE CATALAO,Pública,1,1,Avenida Doutor Lamartine Pinto de Avelar,1120,Loteamento Vila Chaud,-,75704020.0
4721,UNIVERSIDADE FEDERAL DO AGRESTE DE PERNAMBUCO,UFAPE,UNIVERSIDADE FEDERAL DO AGRESTE DE PERNAMBUCO - UFAPE,Pública,1,1,Avenida Bom Pastor,S/N,Boa Vista,-,55292270.0
4722,UNIVERSIDADE FEDERAL DO DELTA DO PARNAIBA,UFDPAR,UNIVERSIDADE FEDERAL DO DELTA DO PARNAIBA - UFDPAR,Pública,1,1,Avenida São Sebastião,2.819,Nossa Senhora de Fátima,- até 2819 - lado ímpar,64202020.0
4723,UNIVERSIDADE FEDERAL DE JATAÍ,UFJ,UNIVERSIDADE FEDERAL DE JATAI,Pública,1,1,Rodovia BR-364,-,Setor Francisco Antônio,-,75801615.0
4724,Universidade Federal de Rondonópolis,UFR,UNIVERSIDADE FEDERAL DE RONDONOPOLIS,Pública,1,1,Av Avenida dos Estudantes,5055,Cidade Universitária,-,78736900.0
4725,UNIVERSIDADE CATÓLICA DE PERNAMBUCO,UNICAP,ASSOCIACAO ANTONIO VIEIRA,Privada,5,1,Rua do Príncipe,526,Boa Vista,Campus Universitário-UNICAP,50050900.0
4726,UNIVERSIDADE FEDERAL DO RIO GRANDE,FURG,UNIVERSIDADE FEDERAL DO RIO GRANDE - FURG,Pública,1,1,Avenida Itália,S/N,Carreiros,Km 8,96203900.0
4727,Centro Universitário Vale do Rio Verde,,FUNDACAO COMUNITARIA TRICORDIANA DE EDUCACAO,Privada,5,2,Avenida Castelo Branco,82,Chacara das Rosas,-,37417150.0
4728,UNIVERSIDADE DO ESTADO DO PARÁ,UEPA,UNIVERSIDADE DO ESTADO DO PARA UEP,Pública,2,1,Travessa Djalma Dutra,S/N,Telégrafo Sem Fio,-,66113010.0
4729,Claretiano - Centro Universitário,CLARETIANOBT,ACAO EDUCACIONAL CLARETIANA,Privada,5,2,Rua Dom Bosco,466,Castelo,-,14300172.0
4730,CENTRO UNIVERSITÁRIO SAGRADO CORAÇÃO,UNISAGRADO,INSTITUTO DAS APOSTOLAS DO SAGRADO CORACAO DE JESUS,Privada,5,2,Rua Irmã Arminda,10-50,Jardim Brasil,-,17011160.0
4731,ESCOLA DE ADMINISTRAÇÃO DE EMPRESAS DE SÃO PAULO - FGV EAESP,FGV-EAESP,FUNDACAO GETULIO VARGAS,Privada,5,3,Avenida 9 de Julho,2029,Bela Vista,-,1313902.0
4732,FACULDADE NOVA ROMA CARUARU,FNR CARUARU,CENTRO BRASILEIRO DE PROFISSIONALIZACAO EMPRESARIAL LTDA,Privada,4,3,Rua Azevedo Coutinho,s/n,Petrópolis,Térreo,55030902.0
4733,CENTRO UNIVERSITÁRIO ÍTALO-BRASILEIRO,UNIÍTALO,INSTITUICAO EDUCACIONAL PROFESSOR PASQUALE CASCINO,Privada,5,2,Avenida João Dias,2046,Santo Amaro,-,4724003.0
4734,Universidade Pitágoras Unopar Anhanguera,,EDITORA E DISTRIBUIDORA EDUCACIONAL S/A,Privada,4,1,Avenida Paris,675,Parque Residencial João Piza,-,86041120.0
4735,FACULDADE DE JOÃO PESSOA (SANTA EMÍLIA DO RODAT),,UNIESP S.A,Privada,5,3,Rua José Liberato,437,Miramar,Faculdade Unineves Santa Emília de Rodat,58043100.0
4736,Universidade Evangélica de Goiás,UniEVANGÉLICA,ASSOCIACAO EDUCATIVA EVANGELICA,Privada,5,1,Avenida Universitária,s/n,Cidade Universitária,"Km 3,5",75083515.0
4737,Centro Universitário Ruy Barbosa Wyden,UniRuy Wyden,ABEP - ACADEMIA BAIANA DE ENSINO PESQUISA E EXTENSAO LTDA,Privada,4,2,Av. Luis Viana Filho,3172,Imbuí,SALVADOR - IMBUÍ - PARALELA,41720200.0
4738,FACULDADE DE SÃO PAULO,FASP,UNIESP S.A,Privada,4,3,Rua Álvares Penteado,216,Centro,-,1012001.0
4739,UNIVERSIDADE DO CONTESTADO,UNC,FUNDACAO UNIVERSIDADE DO CONTESTADO - FUNC,Privada,5,1,Avenida Presidente Nereu Ramos,1071,Jardim do Moinho,-,89306076.0
4740,UNIVERSIDADE DE CRUZ ALTA,UNICRUZ,FUNDACAO UNIVERSIDADE DE CRUZ ALTA,Privada,5,1,Rodovia Municipal Jacob Della Mea,s/n,Parada Benito,"KM 5,6",98020290.0
4741,CENTRO UNIVERSITÁRIO RITTER DOS REIS,UNIRITTER,SOCIEDADE DE EDUCACAO RITTER DOS REIS LTDA.,Privada,4,2,Rua Orfanotrófio,555,Alto Teresópolis,-,90840440.0
4742,CENTRO UNIVERSITÁRIO ARMANDO ALVARES PENTEADO,FA-FAAP,FUNDACAO ARMANDO ALVARES PENTEADO,Privada,5,2,Rua Alagoas,903,HIGIENOPOLIS,PRÉDIO 01,1242902.0
4743,Centro Universitário Anhanguera Pitágoras Unopar de Niterói,UNIAN-RJ,ANHANGUERA EDUCACIONAL PARTICIPACOES S/A,Privada,4,2,Rua Visconde do Rio Branco,123,Centro,Unidade SEDE,24020000.0
4744,PONTIFÍCIA UNIVERSIDADE CATÓLICA DO RIO DE JANEIRO,PUC-RIO,FACULDADES CATOLICAS,Privada,5,1,Pontifícia Universidade Católica - PUC,225,Gávea,Rua Marques São Vicente,22451900.0
4745,"FUNDAÇÃO FACULDADE DE FILOSOFIA, CIÊNCIAS E LETRAS DE MANDAGUARI",FAFIMAN,"FUNDACAO FACULDADE DE FILOSOFIA, CIENCIAS E LETRAS DE MANDAGUARI",Pública,3,3,Rua: Renê Táccola,152,CENTRO,-,86975000.0
4746,UNIVERSIDADE FEDERAL RURAL DA AMAZÔNIA,UFRA,UNIVERSIDADE FEDERAL RURAL DA AMAZONIA,Pública,1,1,Avenida Presidente Tancredo Neves,2501,Terra Firme,-,66077580.0
4747,UNIVERSIDADE FEDERAL DE LAVRAS,UFLA,UNIVERSIDADE FEDERAL DE LAVRAS,Pública,1,1,Rua Prof. Edmir Sá Santos,S/N,Campus Universitário,-,37200900.0
4748,"INSTITUTO FEDERAL DE EDUCAÇÃO, CIÊNCIA E TECNOLOGIA DO MARANHÃO",IFMA,"INSTITUTO FEDERAL DE EDUCACAO, CIENCIA E TECNOLOGIA DO MARANHAO",Pública,1,4,Avenida Getúlio Vargas,4,Monte Castelo,-,65030005.0
4749,"ESCOLA SUPERIOR DE CRUZEIRO ""PREFEITO HAMILTON VIEIRA MENDES""",ESEFIC,ESCOLA SUPERIOR DE CRUZEIRO PREFEITO HAMILTON VIEIRA MENDES,Pública,3,3,Rua Doutor José Rodrigues Alves Sobrinho,191,Vila Celestina,-,12710410.0
4750,INSTITUTO MILITAR DE ENGENHARIA,IME,COMANDO DO EXERCITO,Pública,1,3,Praça General Tibúrcio,80,URCA,-,22290270.0
4751,FACULDADE SANTA CECÍLIA,FASC,ASSOCIACAO DE EDUCACAO SANTA CECILIA (FASC),Privada,5,3,Praça Barão do Rio Branco,59,Centro,-,12400280.0
4752,FACULDADE DO NOROESTE DE MINAS,FINOM,INSTITUTO TECSOMA LTDA - ITEC,Privada,4,3,Rodovia Alírio Herval,3405,Paracatuzinho,-,38603200.0
4753,FACULDADE DE PETROLINA,FACAPE,AUTARQUIA EDUCACIONAL DO VALE DO SAO FRANCISCO,Especial,7,3,Campus Universitário,S/N,VILA EDUARDO,-,56328903.0
4754,FUNDAÇÃO UNIVERSIDADE FEDERAL DE RONDÔNIA,UNIR,FUNDACAO UNIVERSIDADE FEDERAL DE RONDONIA,Pública,1,1,BR 364,"Km 9,5",s/n,Zona Rural,76808695.0
4755,FACULDADE DE ANICUNS,FA,FUNDACAO EDUCACIONAL DE ANICUNS,Pública,3,3,Go 326,S/N,Centro,-,76170000.0
