IDInstituicao,NomeInstituicao,SiglaInstituicao,NomeMantenedora,RedeEnsino,TipoDeCategoriaAdministrativa,TIpoOrganizacaoAcademica,Endereco,NumEndereco,BairroEndereco,ComplementoEndereco,CEP
1603,FACULDADE DE TECNOLOGIA DE PIRACICABA,FATEP,INSTITUTO DE DESENVOLVIMENTO TECNOLOGICO E EDUCACIONAL DE PIRACICABA LTDA,Privada,4,3,Rua Silva Jardim,1.763,Cidade Alta,,13419140.0
1604,Centro Universitário Joaquim Nabuco de Recife,UNINABUCO RECIFE,SER EDUCACIONAL S.A.,Privada,4,2,Av. Guararapes,203,Santo Antônio,,50010900.0
1605,FACULDADE METROPOLITANA DE RIO DO SUL,FAMESUL,SOCIEDADE EDUCACIONAL LEONARDO DA VINCI S/S LTDA,Privada,4,3,Rodovia BR-470,5.253,Barra Itoupava,"- do km 140,001 ao k",89162596.0
1606,Faculdade SENAC Goiás,FacSenacGO,SERVICO NACIONAL DE APRENDIZAGEM COMERCIAL - SENAC,Privada,5,3,Avenida Caiapó,41/43/45/4,Santa Genoveva,Campus Santa Genovev,74672400.0
1607,CENTRO UNIVERSITÁRIO BARRIGA VERDE,UNIBAVE,FUNDACAO EDUCACIONAL BARRIGA VERDE,Privada,5,2,Rua Pe.João Leonir Dall'Alba,s/n,Murialdo,,88870000.0
1608,CENTRO DE ENSINO SUPERIOR DE UBERABA,CESUBE,ASSOCIACAO EDUCACIONAL DR. ODILON FERNANDES,Privada,5,3,Avenida Doutor Randolfo Borges Júnior,1250,Univerdecidade,,38064200.0
1609,Faculdade Estácio de Carapicuíba,ESTÁCIO CARAPICUÍBA,CENTRO EDUCACIONAL NOSSA CIDADE LTDA.,Privada,4,3,AV. FRANCISCO PIGNATARI,630,VILA GUSTAVO CORREIA,,6310330.0
1610,FACULDADE JK DE TECNOLOGIA,FACJK,AESJK - ASSOCIACAO DE ENSINO SUPERIOR JUSCELINO KUBITSCHEK,Privada,5,3,Shin Ca2,21,Lago Norte,Lote 21,71503502.0
1611,FACULDADE PERUIBE,FPBE,"UNISEPE UNIAO DAS INSTITUICOES DE SERVICO, ENSINO E PESQUISA LTDA",Privada,4,3,Avenida Darcy Fonseca,530,Jardim dos Prados,,11750000.0
1612,Faculdade Uninassau Aliança - Redenção,Nassau Aliança,CIESPI-CENTRO INTEGRADO DE EDUCACAO SUPERIOR DO PIAUI LTDA,Privada,4,3,Rua São Pedro,965,Centro,,64001260.0
1613,Faculdade Morgana Potrich,FAMP,CENTRO DE ENSINO SUPERIOR MORGANA POTRICH EIRELI,Privada,4,3,Praça Praça José Alves de Assis,58,Centro,,75830074.0
1614,Faculdade JK Brasília - Recanto das Emas II,,JK EDUCACIONAL LTDA,Privada,5,3,Quadra SEPS 707/907,S/N,Asa Sul,Faculdade JK - Brasí,70390078.0
1615,FACULDADES INTEGRADAS DO BRASIL UNIFUTURO,Faculdade Unifuturo,UNIFUTURO FACULDADES INTEGRADAS DO BRASIL EIRELI,Privada,4,3,Avenida Odon Bezerra,184,Tambiá,Loja 256 2º andar  -,58020500.0
1616,Faculdade de Tecnologia e Ciências de Minas Gerais,FATEC MG,ASSEDIPA CURSOS E TREINAMENTOS SOCIEDADE SIMPLES LTDA - EPP,Privada,4,3,Rua Pouso Alegre,216,Centro,,35160036.0
1617,Faculdade ESAMC São Paulo - ESAMC,ESAMC,CENTRO DE ESTUDOS DE ADMINISTRACAO E MARKETING CEAM LTDA,Privada,4,3,Rua Caiubi,127,Perdizes,,5010000.0
1618,FACULDADE PEDRO LEOPOLDO,FPL,FUNDACAO CULTURAL DR PEDRO LEOPOLDO,Privada,5,3,Avenida Lincoln Diogo Viana,830,Doutor Lund,,33600000.0
1619,INSTITUTO SUPERIOR DE EDUCAÇÃO PROFESSORA NAIR FORTES ABU-MERHY,ISEFOR,FUNDACAO EDUCACIONAL DE ALEM PARAIBA,Privada,5,3,Rua Isabel Herdy Alves,305,SAO JOSÉ,PRÉDIO DO CAP,36660000.0
1620,FACULDADE PITÁGORAS DE TECNOLOGIA DE BELO HORIZONTE,PIT-FATEC,ORME SERVICOS EDUCACIONAIS LTDA,Privada,4,3,Avenida Afonso Pena,1.901,Centro,SECULUS - Afonso Pen,30130002.0
1621,FACULDADES INTEGRADAS DE CACOAL,UNESC,SOCIEDADE EDUCACIONAL DE RONDONIA S/S LTDA,Privada,5,3,Rua dos Esportes,1038,Incra,,76965864.0
1622,Centro Universitário FIP-MOC,,SOCIEDADE PADRAO DE EDUCACAO SUPERIOR LTDA,Privada,4,2,Avenida Professora Aida Mainartina Paraíso,80,Ibituruna,,39408007.0
1623,INSTITUTO DE FILOSOFIA E TEOLOGIA DE GOIÁS,IFITEG,UNIAO BRASIL CENTRAL DE EDUCACAO E ASSISTENCIA,Privada,5,3,7a Avenida,531,Setor Leste Universitário,,74603030.0
1624,FACULDADE DE INHUMAS - FAC-MAIS,FACMAIS,CENTRO DE EDUCACAO SUPERIOR DE INHUMAS EIRELI,Privada,4,3,Avenida Monte Alegre,100,Monte Alegre,"Quadra 3, Lotes 11 a",75400000.0
1625,FACULDADE DE TECNOLOGIA DE PORTO ALEGRE,FATEPA,QI ESCOLAS E FACULDADES LTDA,Privada,4,3,Avenida Júlio de Castilhos,435,Centro,,90030131.0
1626,FACULDADE ESTÁCIO DO AMAZONAS - ESTÁCIO AMAZONAS,ESTÁCIO AMAZONAS,SOCIEDADE DE ENSINO SUPERIOR ESTACIO AMAZONAS LTDA,Privada,4,3,Avenida Constantino Nery,3.693,Chapada,CONSTANTINO NERY,69050001.0
1627,FACULDADE DO VALE ELVIRA DAYRELL - FAVED,FAVED,SOCIEDADE DE ENSINO ELVIRA DAYRELL - SOED - EPP,Privada,4,3,Rodovia de Ligação da Br 259 À Br 120,s/n,Centro,KM 001,39730000.0
1628,FACULDADE DE TIETÊ,,UNIESP S.A,Privada,4,3,Rua Santa Terezinha,425,Belvedere,,18530000.0
1629,FACULDADE SENAC JARAGUÁ DO SUL,,SERVICO NACIONAL DE APRENDIZAGEM COMERCIAL - SENAC,Privada,5,3,Rua dos Imigrantes,410,Vila Rau,,89254430.0
1630,FACULDADE DO CENTRO EDUCACIONAL MINEIRO - FACEM,FACEM-BH,SOCIEDADE DE ENSINO SUPERIOR MINEIRO LTDA - SESM - ME,Privada,4,3,Rua Eufrates,30,Alípio de Melo,,30881310.0
1631,FACULDADE EFICAZ,EFICAZ,FACULDADE EFICAZ MARINGA LTDA,Privada,4,3,Avenida João Paulino Vieira Filho,729,Novo Centro,,87020015.0
1632,FACULDADE DE TECNOLOGIA DE PALMAS,FTP,INSTITUTO DE EDUCACAO VERBO LTDA - ME,Privada,4,3,Quadra 1401 Sul Avenida Joaquim Teotônio Segurado,S/N,Plano Diretor Sul,Conjunto 01 Lote 02,77019740.0
1633,FACULDADE DE CIÊNCIAS SOCIAIS DOS PALMARES,FACIP,AUTARQUIA EDUCACIONAL DA MATA SUL,Especial,7,3,Br 101 K 186 Sul,s/n,Engenho São Manoel,,55540000.0
1634,FACULDADE QUALITTAS,QUALITTAS,UNIAO NACIONAL DE EDUCACAO E TECNOLOGIA UNITEC EIRELI,Privada,4,3,Avenida Paulista,302/306,Bela Vista,"Conjuntos 10,50,60,7",1310000.0
1635,"INSTITUTO FEDERAL DE EDUCAÇÃO, CIÊNCIA E TECNOLOGIA DO SUL DE MINAS GERAIS",IF SUL DE MINAS,"INSTITUTO FEDERAL DE EDUCACAO, CIENCIA E TECNOLOGIA DO SUL DE MINAS GERAIS",Pública,1,4,Avenida Vicente Simões,1111,Nova Pouso Alegre,,37553465.0
1636,FACULDADE PITÁGORAS DE BETIM,PITÁGORAS-BETIM,PITAGORAS - SISTEMA DE EDUCACAO SUPERIOR SOCIEDADE LTDA,Privada,4,3,Avenida Edméia Mattos Lazzarotti,1655,Angola,- de 1501 a 2299 - l,32604155.0
1637,FACULDADE TERRA NORDESTE,FATENE,SOCIEDADE UNINORDESTE DE EDUCACAO UNIVERSITARIA DE CAUCAIA S/S LTDA,Privada,4,3,Rua Coronel Correia,1119,Parque Soledade,- até 1179/1180,61603005.0
1638,CENTRO UNIVERSITÁRIO DE MINEIROS,UNIFIMES,FUNDACAO INTEGRADA MUNICIPAL DE ENSINO SUPERIOR,Pública,3,2,Rua 22,S/N,Setor Aeroporto,Esquina com Avenida,75830000.0
1639,FACULDADE DE BALSAS,UNIBALSAS,UNIBALSAS EDUCACIONAL LTDA,Privada,4,3,Br 230 Km 5,s/n,Fazenda Malidere 4,,65800000.0
1640,FACULDADE PANAMERICANA DE JI-PARANÁ,,UNIJIPA - UNIAO DAS ESCOLAS SUPERIORES DE JI-PARANA LTDA,Privada,5,3,Rodovia 135 KM 1,,Zona Rural,Estrada Nova Londrin,76900202.0
1641,FACULDADE JK - UNIDADE I - GAMA,,IDEA - INSTITUTO DE DESENVOLVIMENTO EDUCACIONAL AVANCADO S/S LTDA,Privada,4,3,Área Especial Lotes 18 a 22,s/n,Gama,JK GAMA,72405370.0
1642,FACULDADES INTEGRADAS BARROS MELO,FIBAM,AESO-ENSINO SUPERIOR DE OLINDA LTDA,Privada,4,3,Avenida Transamazônica,405,Jardim Brasil II,,53300240.0
1643,FACULDADE PROFESSOR MIGUEL ÂNGELO DA SILVA SANTOS,FEMASS,FUNDACAO EDUCACIONAL DE MACAE,Pública,3,3,Rua Aloísio da Silva Gomes,50,Granja dos Cavaleiros,,27930560.0
1644,CENTRO UNIVERSITÁRIO UNIGRAN CAPITAL,,UNIGRAN EDUCACIONAL,Privada,5,2,Rua Abrão Júlio Rahe,325,Centro,- até 1010/1011,79010010.0
1645,FACULDADE DE ENFERMAGEM NOVA ESPERANÇA DE MOSSORÓ - FACENE/RN,FACENE/RN,ESCOLA DE ENFERMAGEM NOVA ESPERANCA LTDA,Privada,4,3,Avenida Presidente Dutra,701,Alto de São Manoel,,59628000.0
1646,ESCOLA SUPERIOR PAULISTA DE ADMINISTRAÇÃO - ESPA,ESPA,UNIESP S.A,Privada,4,3,Rua João Gonçalves,455/471,Centro,,7010010.0
1647,FACULDADE AMÉRICA LATINA  DE IJUÍ,FAL,SOCIEDADE EDUCACIONAL RIO CLARO LTDA,Privada,4,3,Rua 13 de maio,67,Centro,,98700000.0
1648,CENTRO UNIVERSITÁRIO METROPOLITANO DA AMAZÔNIA,UNIFAMAZ,INSTITUTO EURO AMERICANO DE EDUCACAO CIENCIA TECNOLOGIA,Privada,5,2,Avenida Visconde de Souza Franco,72,Reduto,,66053000.0
1649,CENTRO UNIVERSITÁRIO PITÁGORAS DE MARABÁ,,CENTRO DE ENSINO SUPERIOR DE MARABA LTDA,Privada,4,2,Rod. BR 230 KM 05,0,Nova Marabá,,68502700.0
1650,FACULDADE DOM PEDRO II DE TECNOLOGIA,FAB,INSTITUICAO BAIANA DE ENSINO SUPERIOR LTDA,Privada,4,3,Praça da Inglaterra,6,Comércio,Ed. BIG,40015140.0
1651,FACULDADE PASCHOAL DANTAS,FPD,ASSOCIACAO EDUCACIONAL PASCHOAL DANTAS,Privada,5,3,Avenida Afonso de Sampaio e Sousa,495,Parque do Carmo,,8270000.0
1652,FACULDADE ANHANGUERA JARAGUÁ DO SUL,,ANHANGUERA EDUCACIONAL PARTICIPACOES S/A,Privada,4,3,Rua Major Júlio Ferreira,s/n,Vila Lalau,,89256210.0
1653,FACULDADE DE TECNOLOGIA DO VALE DO IVAÍ,FATEC-IVAI,UNESVI - UNIAO DE ENSINO SUPERIOR DO VALE DO IVAI LTDA,Privada,4,3,Avenida Brasil,45,Centro,,86870000.0
1654,FACULDADES INTEGRADAS CAMPO-GRANDENSES,FIC,FUNDACAO EDUCACIONAL UNIFICADA CAMPOGRANDENSE,Privada,5,3,Estrada da Caroba,685,Campo Grande,,23085590.0
1655,UNIVERSIDADE FEDERAL DO RECÔNCAVO DA BAHIA,UFRB,UNIVERSIDADE FEDERAL DO RECONCAVO DA BAHIA - UFRB,Pública,1,1,Rua Rui Barbosa,710,Centro,Sede da UFRB,44380000.0
1656,FUNDAÇÃO UNIVERSIDADE FEDERAL DA GRANDE DOURADOS,UFGD,FUNDACAO UNIVERSIDADE FEDERAL DA GRANDE DOURADOS,Pública,1,1,Rua João Rosa Góes,1761,Vila Progresso,,79825070.0
1657,FACULDADE REGIONAL PALMITOS,FAP,SOCIEDADE EDUCACIONAL PALMITOS LTDA,Privada,4,3,Avenida Brasil,s/n,Centro,,89887000.0
1658,CENTRO UNIVERSITÁRIO CATÓLICO SALESIANO AUXILIUM,UNISALESIANO,MISSAO SALESIANA DE MATO GROSSO,Privada,5,2,Rua Dom Bosco,265,Centro,,16400505.0
1659,CENTRO UNIVERSITÁRIO TIRADENTES,FITS,SOCIEDADE DE EDUCACAO TIRADENTES LTDA,Privada,4,2,Avenida Gustavo Paiva,5.017,Cruz das Almas,,57031530.0
1660,FACULDADE ADVENTISTA DA BAHIA,FADBA,INSTITUICAO ADVENTISTA NORDESTE BRASILEIRA DE EDUCACAO E ASSISTENCIA SOCIAL,Privada,5,3,Br 101 Km 197,s/n,Capueiruçu,Estrada Capueiruçu,44300000.0
1661,FACULDADE DE TECNOLOGIA SENAI CAMPO GRANDE,,SENAI-SERVICO NACIONAL DE APRENDIZAGEM INDUSTRIAL,Privada,5,3,Avenida Afonso Pena,1114,Amambaí,,79005903.0
1662,FACULDADE SÃO FRANCISCO DA PARAÍBA,FASP,VERA CLAUDINO EDUCACAO SUPERIOR LIMITADA - ME,Privada,4,3,Avenida Brasil,S/N,Jardim Adalgisa,Rodovia 393,58900000.0
1663,FACULDADE HERRERO,FATEC,SOCIEDADE EDUCACIONAL HERRERO LTDA. - SS - EPP,Privada,4,3,Rua Álvaro Andrade,345/322,Portão,,80610240.0
1664,ESTÁCIO FATERN - FACULDADE ESTÁCIO DO RIO GRANDE DO NORTE,ESTÁCIO FATERN,SOCIEDADE UNIVERSITARIA DE EXCELENCIA EDUCACIONAL DO RIO GRANDE DO NORTE LTDA,Privada,4,3,Rua Dr Hernany Hugo Gomes,90,Capim Macio,,59082270.0
1665,FACULDADE CENTRO MATO-GROSSENSE,,FUNDACAO EDUCACIONAL CLAUDINO FRANCIO,Privada,5,3,Rua Rui Barbosa,380,Centro,,78890000.0
1666,Faculdade Facese,Facese,FACULDADE FACESE LTDA - ME,Privada,4,3,rua joaquim nabuco,968,tingui,,82620060.0
1667,FACULDADE DO NORTE GOIANO,FNG,CENTRO DE EDUCACAO SUPERIOR DO NORTE GOIANO LTDA,Privada,4,3,Rua 06,21,Setor Leste,Esquina com a Rua 01,76550000.0
1668,FACULDADE APOGEU,APOGEU,APOGEU CENTRO INTEGRADO DE EDUCACAO LTDA - ME,Privada,4,3,Área Especial 12,0,Setor Sul (Gama),Lote D,72415520.0
1669,FACULDADE CATÓLICA DE RONDONIA,FCR,ASSOCIACAO DE ASSISTENCIA A CULTURA NA AMAZONIA MOACYR GRECHI - AASCAM,Privada,5,3,Gonçalves Dias,290,Centro,,78900030.0
1670,FACULDADE REGES DE RIBEIRÃO PRETO,,REDE GONZAGA DE ENSINO SUPERIOR - REGES,Privada,5,3,Rua Doutor Benjamim Anderson Stauffer,801,Jardim Botânico,,14021617.0
1671,FACULDADE FUTURA,,"INSTITUTO DE CIENCIA, EDUCACAO E TECNOLOGIA DE VOTUPORANGA",Privada,5,3,Avenida Vale do Sol,4876,Vale do Sol,,15500269.0
1672,FACULDADE DE TECNOLOGIA ASSESSORITEC,,ASSOCIACAO EDUCACIONAL E TECNOLOGICA DE SANTA CATARINA,Privada,5,3,Rua Marques do Pombal,287,Iririú,,89227110.0
1673,FACULDADE DE EDUCAÇÃO E MEIO AMBIENTE,FAEMA,UNIDAS SOCIEDADE DE EDUCACAO E CULTURA LTDA,Privada,4,3,Avenida Machadinho,4.349,Área de Expansão Urbana,,76873630.0
1674,FACULDADE ANHANGUERA DE CAXIAS DO SUL,,ANHANGUERA EDUCACIONAL PARTICIPACOES S/A,Privada,4,3,Avenida Alexandre Rizzo,491,Desvio Rizzo,,95110000.0
1675,Faculdade Innovare,FACINN,INNOVARE COOPERATIVA EDUCACIONAL,Privada,4,3,Rua João Martins,448,Parque Cruzeiro do Sul,,8070330.0
1676,FACULDADE ANGLO-AMERICANO DE JOÃO PESSOA,FAAJP,CENTRO NORDESTINO DE ENSINO SUPERIOR S/S LTDA,Privada,4,3,Ladeira de São Francisco,16,Centro,,58010630.0
1677,FACULDADE IDEAU DE CAXIAS DO SUL,IDEAU,INSTITUTO DE DESENVOLVIMENTO EDUCACIONAL DE CAXIAS DO SUL LTDA,Privada,4,3,Rua Feijó Júnior,1049,São Pelegrino,,95034160.0
1678,Faculdade IDEAU de Passo Fundo,IDEAU,INSTITUTO DE DESENVOLVIMENTO EDUCACIONAL DE PASSO FUNDO LTDA,Privada,4,3,Avenida Rui Barbosa,103,Vila Petrópolis,Quadra 138,99050120.0
1679,FACULDADE ANHANGÜERA DE SÃO JOSÉ,,ANHANGUERA EDUCACIONAL PARTICIPACOES S/A,Privada,4,3,Avenida Dr. João Batista de Souza Soares,4.009,Cidade Morumbi,Unidade SEDE,12236660.0
1680,FACULDADE ANHANGÜERA DE SOROCABA,FSO,ANHANGUERA EDUCACIONAL PARTICIPACOES S/A,Privada,4,3,Avenida Doutor Armando Pannunzio,1478,Jardim Vera Cruz,,18050000.0
1681,FACULDADE ANHANGÜERA DE PIRACICABA,,ANHANGUERA EDUCACIONAL PARTICIPACOES S/A,Privada,4,3,Rua Santa Catarina,1.005,Piracicamirim,,13425075.0
1682,FACULDADE UNIBF,,UNIAO BRASILEIRA DE FACULDADES - UNIBF,Privada,4,3,Rua Olavo Bilac,78,Centro,,87780000.0
1683,FACULDADE DELTA,FACULDADE DELTA,CENTRO TECNOLOGICO DELTA LTDA - ME,Privada,4,3,Avenida São Carlos,911,Jardim Planalto,"Quadra 39, Lote 23",74333020.0
1684,FACULDADE PORTO DAS ÁGUAS,FAPAG,SOCIEDADE EDUCACIONAL PORTO DAS AGUAS LTDA. - ME,Privada,4,3,Rodovia Sc 412 Km 02,1499,Perequê,,88210000.0
1685,FACULDADE CENTRO PAULISTANO,,UNIESP S.A,Privada,5,3,Rua David Eid,241,Interlagos,,4438000.0
1686,FACULDADE NOROESTE,FAN,CENTRO DE ENSINO NOROESTE LTDA - ME,Privada,4,3,Avenida Mangalô,2385,Morada do Sol,,74085010.0
1687,FACULDADE NOVA ROMA,FNR,CENTRO BRASILEIRO DE PROFISSIONALIZACAO EMPRESARIAL LTDA,Privada,4,3,Estrada do Bongi,425,Prado,,50830260.0
1688,CENTRO UNIVERSITÁRIO BRASILEIRO,UNIBRA,IBGM - INSTITUTO BRASILEIRO DE GESTAO & MARKETING LTDA - EPP,Privada,4,2,Rua Joaquim Felipe,250,Boa Vista,,50050340.0
1689,Faculdade de Ensino Regional Alternativa,FERA,SOESA - SOCIEDADE DE ENSINO SUPERIOR DO AGRESTE LTDA - ME,Privada,4,3,Rua Marechal Floriano Peixoto,98,Eldorado,,57306230.0
1690,FACULDADES INTEGRADAS VIANNA JÚNIOR,FIVJ,INSTITUTO VIANNA JUNIOR LTDA,Privada,4,3,Avenida dos Andradas,415,Centro,,36036000.0
1691,FACULDADE DE CIÊNCIAS HUMANAS DO ESTADO DE SÃO PAULO,FACIC,INSTITUTO VALE EDUCACAO,Privada,5,3,Rua dos Andradas,1039,Vila Brasil,,12703030.0
1692,FACULDADE DE TECNOLOGIA EGÍDIO JOSÉ DA SILVA,FATEGIDIO,ESCOLA TECNICA EGIDIO JOSE DA SILVA - EPP,Privada,4,3,Rua Jalile Naaman,70,Grão Pará,CASA,39801118.0
1693,FACULDADE MESSIANICA,,FUNDACAO MOKITI OKADA-M.O.A.,Privada,5,3,Rua Humberto I,612,Vila Mariana,,4015050.0
1694,FACULDADE DE TECNOLOGIA SENAC DF,FAC SENAC DF,SENAC - SERVICO NACIONAL DE APRENDIZAGEM COMERCIAL - ADMINIS,Privada,5,3,Quadra SEPS 703/903,s/n,Asa Sul,,70390039.0
1695,Faculdade Uninassau Olinda - Nassau Olinda,,SER EDUCACIONAL S.A.,Privada,5,3,Rua Eduardo de Moraes,s/n,Casa Caiada,Sede Shopping Patteo,53130635.0
1696,FACULDADE REGIONAL DE RIACHÃO DO JACUÍPE,FARJ,"UNIDADE DE ENSINO, PESQUISA E EXTENSAO DE RIACHAO DO JACUIPE EIRELI",Privada,4,3,Rua Manoel Mascarenhas,98,Barra,,44640000.0
1697,FACULDADE DE TECNOLOGIA E CIENCIAS DO NORTE DO PARANÁ,FATECIE,FACULDADE DE TECNOLOGIA E CIENCIAS DO NORTE DO PARANA LTDA - ME,Privada,4,3,"Rodovia BR - 376, Km 102 - Rodovia do Café Governador Ney Braga",s/n,Chácara Jaraguá,Unidade SEDE BR,87720140.0
1698,CENTRO UNIVERSITÁRIO MUNICIPAL DE SÃO JOSÉ,USJ,FUNDACAO EDUCACIONAL MUNICIPAL,Pública,3,2,Rua Silvia Maria Fabro,97,Kobrasol,,88102430.0
1699,FACULDADE DE TECNOLOGIA ALFA DE UMUARAMA,,OMEGA SISTEMA DE ENSINO PARANAENSE LTDA,Privada,4,3,Rua Desembargador Antônio Ferreira da Costa,3.678,Zona I,,87501200.0
1700,FACULDADE UNA DE CONTAGEM,FUNAC,SOCIEDADE DE EDUCACAO SUPERIOR E CULTURA - SOCIESC S.A.,Privada,4,3,Avenida João César de Oliveira,5775,Beatriz,,32040000.0
1701,FACULDADE IBS,IBS,IBS BUSINESS SCHOOL DE MINAS GERAIS LTDA,Privada,4,3,Avenida Prudente de Morais,444,Cidade Jardim,,30380000.0
1702,FACULDADE KENNEDY DE BELO HORIZONTE,FKBH,SEIM - SOCIEDADE EDUCACIONAL IRMAOS MUNIZ LTDA,Privada,4,3,Rua José Dias Vieira,46,"Rio Branco, Distrito Venda Nova",,31535040.0
1703,FACULDADE DE CIÊNCIAS DA SAÚDE DE UNAÍ,FACISA,FACISA NOROESTE LTDA - EPP,Privada,5,3,Avenida Governador Valadares,1441,Centro,,38610000.0
1704,FACULDADE CDL,,CAMARA DE DIRIGENTES LOJISTAS DE FORTALEZA,Privada,5,3,Rua 25 de Março,882,Centro,,60060120.0
1705,INSTITUTO FEDERAL DE EDUCAÇÃO CIÊNCIA E TECNOLOGIA DE RONDÔNIA,IFRO,"INSTITUTO FEDERAL DE EDUCACAO,CIENCIA E TECNOLOGIA DE RONDONIA",Pública,1,4,Avenida Calama,994,Flodoaldo Pontes Pinto,- de 4753 a 5143 - l,76820441.0
1706,"INSTITUTO FEDERAL DE EDUCAÇÃO, CIÊNCIA E TECNOLOGIA DO TOCANTINS",IFTO,"INSTITUTO FEDERAL DE EDUCACAO, CIENCIA E TECNOLOGIA DO TOCANTINS",Pública,1,4,Quadra 202 Sul Avenida Joaquim Teotônio Segurado,8,Plano Diretor Sul,"ACSUSE 20, conjunto",77020450.0
1707,FACULDADE DE TECNOLOGIA CENTEC - CARIRI,CENTEC,INSTITUTO CENTRO DE ENSINO TECNOLOGICO,Privada,5,3,Avenida Amália Xavier de Oliveira,s/n,Triângulo,,63040000.0
1708,FACULDADES INTEGRADAS DE ITARARÉ,FAFIT-FACIC,SOCIEDADE ITARAREENSE DE ENSINO LTDA,Privada,4,3,Rua João Batista  Veiga,1.725,Cruzeiro,,18460000.0
1709,FACULDADE ANTÔNIO MENEGHETTI,AMF,FOIL LTDA - EPP,Privada,4,3,Estrada Recanto Maestro,338,Distrito Recanto Maestro,,97200000.0
1710,FACULDADE DE TECNOLOGIA SENAI FELIX GUISARD,,SERVICO NACIONAL DE APRENDIZAGEM INDUSTRIAL,Privada,5,3,Avenida Independência,846,Independência,,12031001.0
1711,FACULDADE DE TECNOLOGIA SENAI NADIR DIAS DE FIGUEIREDO,,SERVICO NACIONAL DE APRENDIZAGEM INDUSTRIAL,Privada,5,3,Rua Ari Barroso,305,Presidente Altino,,6216901.0
1712,FACULDADE DE TECNOLOGIA SENAI ANCHIETA,,SERVICO NACIONAL DE APRENDIZAGEM INDUSTRIAL,Privada,5,3,Rua Gandavo,550,Vila Mariana,,4023001.0
1713,FACULDADE DE TECNOLOGIA SENAI MARIANO FERRAZ,,SERVICO NACIONAL DE APRENDIZAGEM INDUSTRIAL,Privada,5,3,Rua Jaguaré Mirim,71,Vila Leopoldina,,5311020.0
1714,FACULDADE DE TECNOLOGIA SENAI ANTÔNIO ADOLPHO LOBBE,,SERVICO NACIONAL DE APRENDIZAGEM INDUSTRIAL,Privada,5,3,Rua Cândido Padim,25,Vila Prado,,13574320.0
1715,FACULDADE PROMINAS DE MONTES CLAROS,PROMINAS,INSTITUTO PROMINAS SERVICOS EDUCACIONAIS LTDA,Privada,4,3,Rua Lírio Brant,511,Melo,,39401063.0
1716,FACULDADE DE TECNOLOGIA EVOLUÇÃO,FECET,SOCIEDADE UNINORDESTE DE EDUCACAO UNIVERSITARIA DE FORTALEZA S/S LTDA,Privada,4,3,Avenida Pedro I,1.276,Centro,,60135101.0
1717,FACULDADE ANHANGÜERA DE CAMPINAS,,ANHANGUERA EDUCACIONAL PARTICIPACOES S/A,Privada,4,3,Rua Emília Stefanelli Ceregatti,s/n,Jardim Morumbi,Faculdade Anhanguera,13052100.0
1718,ESCOLA SUPERIOR DE ARTES CÉLIA HELENA,,ASSOCIACAO DE ARTE E ENSINO SUPERIOR,Privada,5,3,Avenida São Gabriel,462,Itaim Bibi,,1435000.0
1719,FACULDADE DE EDUCAÇÃO  ACRIANA EUCLIDES DA CUNHA,INEC,"INSTITUTO DE PESQUISA, ENSINO E DE ESTUDOS DAS CULTURAS AMAZ",Privada,5,3,Rua do Aviário,204,Aviário,,69900000.0
1720,FACULDADE VÉRTICE,VÉRTICE,SOEGAR-SOCIEDADE EDUCACIONAL GARDINGO LTDA - EPP,Privada,4,3,Rua Bernardo Torres,180,Retiro,,35367000.0
1721,FACULDADE CATÓLICA DO RIO GRANDE DO NORTE,,ASSOCIACAO SANTA TERESINHA DE MOSSORO,Privada,5,3,Praça Dom João Costa,511,Santo Antônio,,59611120.0
1722,Centro Universitário Tocantinense Presidente Antônio Carlos,UNITPAC,ITPAC INSTITUTO TOCANTINENSE PRESIDENTE ANTONIO CARLOS S.A,Privada,4,2,Avenida Filadélfia,568,Setor Oeste,,77816540.0
1723,ESCOLA SUPERIOR DE SAÚDE DE ARCOVERDE,ESSA,AUTARQUIA DE ENSINO SUPERIOR DE ARCOVERDE,Especial,7,3,Rua Gumercindo Cavalcanti,s/n,São Cristóvão,Prédio,56500000.0
1724,FACULDADE PITÁGORAS DE POÇOS DE CALDAS,,PITAGORAS - SISTEMA DE EDUCACAO SUPERIOR SOCIEDADE LTDA,Privada,4,3,Avenida João Pinheiro,1.046,Jardim do Ginásio,,37701386.0
1725,FACULDADE PITÁGORAS DE SÃO LUIZ,,PITAGORAS - SISTEMA DE EDUCACAO SUPERIOR SOCIEDADE LTDA,Privada,4,3,Avenida São Luís Rei de França,59,Turu,Campus Turu II,65065470.0
1726,FACULDADE PITÁGORAS DE GUARAPARI,,PITAGORAS - SISTEMA DE EDUCACAO SUPERIOR SOCIEDADE LTDA,Privada,4,3,Rodovia Jones dos Santos neves,1.000,Lagoa Funda,,29214005.0
1727,FACULDADE DE TECNOLOGIA DE TAUBATÉ,ETEP,CETEC EDUCACIONAL S.A.,Privada,4,3,Avenida Bandeirantes,E-701,Jardim Maria Augusta,- até 1036/1037,12070100.0
1728,FACULDADE ANHANGUERA DE ITAPECERICA DA SERRA,,ANHANGUERA EDUCACIONAL PARTICIPACOES S/A,Privada,4,3,Avenida XV de Novembro,1586,Centro,,6850100.0
1729,FACULDADE DE CONCHAS,,EDUCACIONAL ABRANGE LTDA,Privada,4,3,Rua Itaipu,157,Vila Seminário,,18570000.0
1730,FACULDADE FASIPE,FASIPE,FASIPE CENTRO EDUCACIONAL LTDA - ME,Privada,4,3,Rua Carine,11,Residencial Florença,,78555396.0
1731,FACULDADE BATISTA PIONEIRA,,ASSOCIACAO EDUCACIONAL BATISTA PIONEIRA,Privada,5,3,Rua Dr. Pestana,1021,Centro,,98700000.0
1732,FACULDADE DO TRABALHO,FATRA,INSTITUTO EDUCACIONAL MARIA RANULFA LTDA - EPP,Privada,4,3,Avenida Paes Leme,485,Osvaldo Rezende,,38400124.0
1733,FACULDADE ESTÁCIO DE CASTANHAL,ESTÁCIO CASTANHAL,FACULDADES INTEGRADAS DE CASTANHAL LTDA - EPP,Privada,4,3,Rodovia Br 316 Km 60,s/n,Apeú,,68740420.0
1734,FACULDADE ANGLO,,FACULDADE PORTAL DO ENGENHO LTDA,Privada,4,3,Avenida Maria Elisa,352,Vila Resende,,13405232.0
1735,FACULDADE INTEGRADA DAS CATARATAS,,DIRETIVA ADMINISTRADORA DE PARTICIPACOES LTDA,Privada,4,3,Rua David Muffatto,367,Jardim Comercial das Bandeiras,,85864390.0
1736,FUNDAÇÃO UNIVERSIDADE FEDERAL DO ABC,UFABC,FUNDACAO UNIVERSIDADE FEDERAL DO ABC - UFABC,Pública,1,1,Avenida dos Estados,5001,Santa Teresinha,,9210580.0
1737,FACULDADE DE TECNOLOGIA DE PRAIA GRANDE,FATECPG,CENTRO ESTADUAL DE EDUCACAO TECNOLOGICA PAULA SOUZA,Pública,2,3,Praça 19 de Janeiro,144,Boqueirão,,11700100.0
1738,FACULDADE CLARETIANA DE TEOLOGIA,,ACAO EDUCACIONAL CLARETIANA,Privada,5,3,Avenida Presidente Getúlio Vargas,1193,Rebouças,,80250180.0
1739,ESCOLA SUPERIOR DE ADMINISTRAÇÃO E GESTÃO STRONG DA BAIXADA SANTISTA,,CENTRO DE ENSINO SUPERIOR STRONG,Privada,5,3,Avenida Conselheiro Nébias,159,Paquetá,,11015001.0
1740,FACULDADE INTERNACIONAL DO DELTA,INTA,ASSOCIACAO DOS EDUCADORES DO DELTA DO PARNAIBA - ADP,Privada,5,3,Rua Bel. Benjamin Constant,540,Centro,,64200370.0
1741,FACULDADE AUM,,SOCIEDADE EDUCACIONAL ENES NASCIMENTO LTDA - ME,Privada,4,3,Avenida Dom Aquino,38,Centro,,78015200.0
1742,FACULDADE PITÁGORAS DE FEIRA DE SANTANA,,EDITORA E DISTRIBUIDORA EDUCACIONAL S/A,Privada,4,3,Avenida José Falcão da Silva,1283,Baraúna,,44020122.0
1743,CENTRO UNIVERSITÁRIO DE SETE LAGOAS,UNIFEMM,FUNDACAO EDUCACIONAL MONSENHOR MESSIAS,Privada,5,2,Avenida Marechal Castelo Branco,2.765,Santo Antônio,Campus Universitário,35701242.0
1744,Centro Universitário de Ciências e Tecnologia do Maranhão,UniFacema,FACULDADE DE CIENCIAS E TECNOLOGIA DO MARANHAO LTDA - ME,Privada,4,2,RUA AARÃO REIS,1000,CENTRO,,65606020.0
1745,FACULDADE ITOP,ITOP,INSTITUTO TOCANTINENSE DE EDUCACAO SUPERIOR E PESQUISA LTDA - ME,Privada,4,3,"Quadra ACSUSE 40, Conjunto 02, Lote 16",S/N,Centro,Av. NS - 02,77021634.0
1746,FACULDADE METROPOLITANA DO PLANALTO NORTE,FAMEPLAN,SOCIEDADE EDUCACIONAL DO PLANALTO NORTE LTDA - ME,Privada,4,3,Rua Senador Felipe Schmidt,1355,centro,,89460000.0
1747,FACULDADE DE SÃO JOSÉ DOS CAMPOS,BILAC,CETEC EDUCACIONAL S.A.,Privada,4,3,Rua Francisco Paes,84,Centro,,12200000.0
1748,FACULDADE DE TECNOLOGIA CENTEC - SERTÃO CENTRAL,FTC SERTÃO CENTRAL,INSTITUTO CENTRO DE ENSINO TECNOLOGICO,Privada,5,3,Avenida Geraldo Bizarria,s/n,Distrito Industrial,,63800000.0
1749,Faculdade Educamais,EDUCA+,UPPRIMORE SISTEMA EDUCACIONAL LTDA,Privada,4,3,Rua Dr. Luiz Carlos,1000,Penha,,3505000.0
1750,"Faculdade Ágora - Administração, Educação e Cultura",FAAEC,A T VERDAN CONSULTORIA EDUCACIONAL,Privada,4,3,Rua Conselheiro Dantas,1225,Rebouças,Campus FAAEC,80220191.0
1751,FACULDADE DO MÉDIO PARNAÍBA,,SOCIEDADE DE ENSINO SUPERIOR DO MEDIO PARNAIBA LTDA - ME,Privada,4,3,Rua 18 de Setembro,293,Centro,Ao lado do Emater,64430000.0
1752,CENTRO UNIVERSITÁRIO ESTADUAL DA ZONA OESTE,UEZO,FUNDACAO CENTRO UNIVERSITARIO ESTADUAL DA ZONA OESTE,Pública,2,2,Rua Manuel Caldeira de Alvarenga,1203,Campo Grande,,23070200.0
1753,FACULDADE DE EDUCAÇÃO TECNOLÓGICA DO ESTADO DO RIO DE JANEIRO - FAETERJ,FAETERJ R DE JANEIRO,FUNDACAO DE APOIO A ESCOLA TECNICA DO EST.RIO DE JANEIRO,Pública,2,3,Rua Clarimundo de Melo,847,Quintino Bocaiuva,,21311280.0
1754,FACULDADE DE EDUCAÇÃO TECNOLÓGICA DO ESTADO DO RIO DE JANEIRO - FAETERJ,FAETERJ PETRÓPOLIS,FUNDACAO DE APOIO A ESCOLA TECNICA DO EST.RIO DE JANEIRO,Pública,2,3,Avenida Presidente Getulio Vargas,335,Quitandinha,,25651070.0
1755,INSTITUTO SUPERIOR DE EDUCAÇÃO PROFESSOR ALDO MUYLAERT,ISEPAM,FUNDACAO DE APOIO A ESCOLA TECNICA DO EST.RIO DE JANEIRO,Pública,2,3,Avenida Alair Ferreira,37,Turf Club,Até 410 - lado par,28100000.0
1756,FACULDADE DE EDUCAÇÃO TECNOLÓGICA DO ESTADO DO RIO DE JANEIRO - FAETERJ,FAETERJ S ANT. PÁDUA,FUNDACAO DE APOIO A ESCOLA TECNICA DO EST.RIO DE JANEIRO,Pública,2,3,"Km 2,5 da Rodovia Rj 186",S/N,Divinéia,Antigo Parque de Exp,28470000.0
1757,FACULDADE DE EDUCAÇÃO TECNOLÓGICA DO ESTADO DO RIO DE JANEIRO - FAETERJ,FAETERJ ITAPERUNA,FUNDACAO DE APOIO A ESCOLA TECNICA DO EST.RIO DE JANEIRO,Pública,2,3,Rua Aloísio Dias Moreira,320,Presidente Costa e Silva,,28300000.0
1758,"INSTITUTO FEDERAL DE EDUCAÇÃO, CIÊNCIA E TECNOLOGIA CATARINENSE",IF Catarinense,INSTITUTO FEDERAL DE EDUCACAO CIENCIA E TECNOLOGIA CATARINENSE,Pública,1,4,Rua das Missões,100,Ponta Aguda,,89051000.0
1759,FACULDADE DE CIÊNCIAS SOCIAIS APLICADAS DE MARABÁ,FACIMAB,UNIMA - SOCIEDADE EDUCACIONAL UNIFICADA DE MARABA LTDA - ME,Privada,4,3,Quadra 08 Lote 01 - Loteamento Novo Progresso,s/n,São Felix,,68514000.0
1760,FACULDADE DE TECNOLOGIA PAULISTA,,UNIAO EDUCACIONAL E CULTURAL PIAGET - UNIPIAGET,Privada,5,3,Avenida Santo Inácio,1.089,Jardim Floresta,,17420000.0
