IDInstituicao,NomeInstituicao,SiglaInstituicao,NomeMantenedora,RedeEnsino,TipoDeCategoriaAdministrativa,TIpoOrganizacaoAcademica,Endereco,NumEndereco,BairroEndereco,ComplementoEndereco,CEP
3183,Centro Universitário Estácio de Belo Horizonte - Estácio BH,ESTÁCIO BH,SOCIEDADE DE ENSINO SUPERIOR ESTACIO DE SA LTDA,Privada,4,2,Avenida Francisco Sales,23,Floresta,-,30150220.0
3184,CENTRO UNIVERSITÁRIO ESTÁCIO DE SANTA CATARINA - ESTÁCIO SANTA CATARINA,,SOCIEDADE DE ENSINO SUPERIOR ESTACIO DE SA LTDA,Privada,4,2,Avenida Leoberto Leal,431,Barreiros,- até 805 - lado ímpar,88117001.0
3185,FACULDADE PITÁGORAS INSTITUTO CAMILLO FILHO,PITÁGORAS ICF,SOCIEDADE PIAUIENSE DE ENSINO SUPERIOR LTDA,Privada,4,3,Rua Napoleão Lima,1175,Jóquei Clube,-,64003000.0
3186,FACULDADE VALE DO CRICARÉ,F.V.C.,INSTITUTO VALE DO CRICARE LTDA,Privada,4,3,Rua Humberto de Almeida Franklin,257,Universitário,-,29933480.0
3187,FACULDADE DE EDUCAÇÃO DE PORTO VELHO,UNIRON,UNIRON - UNIAO DAS ESCOLAS SUPERIORES DE RONDONIA LTDA.,Privada,4,3,Avenida Mamoré,1520,Cascalheira,- de 1402 a 1520 - lado par,76813000.0
3188,FACULDADE ANHANGUERA DE TAGUATINGA,,ANHANGUERA EDUCACIONAL PARTICIPACOES S/A,Privada,4,3,Quadra QI 20,S/N,Setor Industrial (Taguatinga),-,71950550.0
3189,CENTRO UNIVERSITÁRIO DE PATO BRANCO,UNIDEP,FADEP - FACULDADE EDUCACIONAL DE PATO BRANCO LTDA,Privada,4,2,Rua Benjamin Borges dos Santos,1100,Fraron,Unidade SEDE,85503350.0
3190,FACULDADE FIA DE ADMINISTRAÇÃO E NEGÓCIOS,FFIA,FUNDACAO INSTITUTO DE ADMINISTRACAO,Privada,5,3,Av. das Nações Unidas,7221,Pinheiros,Unidade Educacional Nações Unidas (UEN),5425902.0
3191,FACULDADE ESTÁCIO DE BELÉM - ESTÁCIO BELÉM,ESTÁCIO BELÉM,ORGANIZACAO PARAENSE EDUCACIONAL E DE EMPREENDIMENTOS LTDA,Privada,4,3,Avenida Governador José Malcher,1148,Nazaré,-,66055260.0
3192,Centro de Ensino Superior CESUL,CESUL,CESUL - CENTRO SULAMERICANO DE ENSINO SUPERIOR LTDA - EPP,Privada,4,3,Avenida Antônio de Paiva Cantelmo,1222,CENTRO,-,85601970.0
3193,FACULDADE OLGA METTIG,FAMETTIG,ECLETICA - NX EDUCACAO E CIENCIA LTDA,Privada,4,3,Avenida Antônio Carlos Magalhães,1116,Itaigara,Sede - Unidade Acadêmica,41825904.0
3194,FACULDADE DE TECNOLOGIA SENAI ANTOINE SKAF,SENAI,SERVICO NACIONAL DE APRENDIZAGEM INDUSTRIAL,Privada,5,3,Rua Anhaia,1321,Bom Retiro,-,3008020.0
3195,Faculdade CNEC Joinville,,CAMPANHA NACIONAL DE ESCOLAS DA COMUNIDADE,Privada,5,3,Rua Coronel Francisco Gomes,1290,Anita Garibaldi,-,89202250.0
3196,Faculdade de Pinhais,FAPI,CENTRO DE ENSINO SUPERIOR DE PINHAIS,Privada,5,3,"Rua Camilo Di Lellis, 1151, Térreo, Estância.",1151,ESTANCIA,-,83320010.0
3197,FACULDADE DE TELÊMACO BORBA,FATEB,FATEB EDUCACAO INTEGRAL LTDA,Privada,4,3,Avenida Marechal Floriano Peixoto,1181,Alto das Oliveiras,-,84266010.0
3198,CENTRO UNIVERSITARIO PROJEÇÃO,UNIPROJEÇÃO,BCEC - BRASIL CENTRAL DE EDUCACAO E CULTURA LTDA,Privada,5,2,"Área Especial 5/6, Setor",s/n,Taguatinga,UniProjeção - Campus I,72115700.0
3199,INSTITUTO DE ENSINO SUPERIOR DE RONDÔNIA,IESUR,FUNDACAO ASSISTENCIAL E EDUCATIVA CRISTA DE ARIQUEMES,Privada,5,3,Avenida Capitão Sílvio,2738,Grandes Áreas,- de 2640 a 2760 - lado par,76876696.0
3200,CENTRO UNIVERSITÁRIO GERALDO DI BIASE,UGB,FUNDACAO EDUCACIONAL ROSEMAR PIMENTEL,Privada,5,2,Rua Deputado Geraldo Di Biase,81,Aterrado,-,27213080.0
3201,FACULDADE DE BOITUVA,FIB,UNIESP S.A,Privada,5,3,Rodovia Sp 129,Km 14,Campo de Boituva,-,18550000.0
3202,FACULDADE DE EDUCAÇÃO SÃO FRANCISCO,FAESF,COLEGIO SAO FRANCISCO,Privada,5,3,Rua Abilio Monteiro,1736,Engenho,-,65725000.0
3203,FACULDADE DE MEDICINA ESTÁCIO DE JUAZEIRO DO NORTE,ESTÁCIO FMJ,"IREP SOCIEDADE DE ENSINO SUPERIOR, MEDIO E FUNDAMENTAL LTDA.",Privada,4,3,Avenida Tenente Raimundo Rocha,S/N,Planalto,-,63047045.0
3204,FACULDADE UNINASSAU PARNAÍBA,,SOCIEDADE DE ENSINO SUPERIOR PIAUIENSE LTDA,Privada,4,3,BR 343,"Km 7,5",Floriópolis,Sede,64202260.0
3205,CENTRO UNIVERSITÁRIO SETE DE SETEMBRO,UNI7,EDUCADORA SETE DE SETEMBRO LTDA,Privada,4,2,Rua Almirante Maximiano da Fonseca,1395,Eng. Luciano Cavalcante,-,60811020.0
3206,UNIVERSIDADE FUMEC,FUMEC,FUNDACAO MINEIRA DE EDUCACAO E CULTURA,Privada,5,1,Rua Cobre,200,Cruzeiro,Campus I Belo Horizonte,30310190.0
3207,Faculdade Doctum de João Monlevade,DOCTUM,INSTITUTO ENSINAR BRASIL,Privada,5,3,Rua 16,24,VILA TANQUE,-,35930408.0
3208,CENTRO UNIVERSITÁRIO DO ESPÍRITO SANTO,UNESC,UNIAO DE EDUCACAO E CULTURA GILDASIO AMADO,Privada,5,2,Avenida Fioravante Rossi,2930,Martinelli,-,29703858.0
3209,FACULDADE ESAMC SOROCABA,ESAMC,ATHON ENSINO SUPERIOR LTDA,Privada,4,3,Rua Arthur Gomes,51,Centro,CAMPUS - SOROCABA - CENTRO,18035490.0
3210,FACULDADE DE ILHA SOLTEIRA,FAISA,UNIESP S.A,Privada,5,3,Alameda Bahia,490-C,Centro,-,15385000.0
3211,CENTRO UNIVERSITÁRIO UNINOVAFAPI,UNINOVAFAPI,INSTITUTO DE ENSINO SUPERIOR DO PIAUI LTDA,Privada,4,2,Rua Vitorino Orthiges Fernandes,6123,Uruguai,-,64073505.0
3212,FACULDADE SUL FLUMINENSE,FASF,INSTITUTO DE CULTURA TECNICA SOCIEDADE CIVIL LTDA,Privada,4,3,Rua Alberto Rodrigues,39,Jardim Amália I,-,27251220.0
3213,FACULDADE UNIME DE CIÊNCIAS JURÍDICAS,FCJ,EDITORA E DISTRIBUIDORA EDUCACIONAL S/A,Privada,4,3,Avenida Avenida Luiz Tarquínio Pontes,600,Centro,-,42702420.0
3214,FACULDADES DOCTUM DE CARATINGA,DOCTUM,INSTITUTO ENSINAR BRASIL,Privada,5,3,Rua João Pinheiro,147,Centro,CAMPUS  - CARATINGA - CENTRO,35300037.0
3215,FACULDADES INTEGRADAS DE ARARAQUARA,FIAR,ASSOCIACAO ESCOLA DE AGRIMENSURA DE ARARAQUARA,Privada,5,3,Avenida Brasil,782,Centro,-,14801050.0
3216,FACULDADE UNIME DE CIÊNCIAS SOCIAIS,FCS,EDITORA E DISTRIBUIDORA EDUCACIONAL S/A,Privada,4,3,Avenida Avenida Luiz Tarquínio Pontes,600,Centro,-,42702420.0
3217,CENTRO UNIVERSITÁRIO ALFREDO NASSER,,ASSOCIACAO APARECIDENSE DE EDUCACAO,Privada,5,2,Avenida Bela Vista,26,Jardim das Esmeralda,-,74905020.0
3218,FACULDADE EDUCACIONAL DE MEDIANEIRA,UDC Medianeira,DIRETIVA ADMINISTRADORA DE PARTICIPACOES LTDA,Privada,4,3,Rua Rio Branco,1820,CENTRO,-,85884000.0
3219,INSTITUTO DE ENSINO SUPERIOR BLAURO CARDOSO DE MATTOS,FASERRA,INSTITUTO DE ENSINO SUPERIOR BLAURO CARDOSO DE MATTOS,Privada,5,3,Rua L,11,Rosário de Fátima,-,29161152.0
3220,"INSTITUTO FEDERAL DE EDUCAÇÃO, CIÊNCIA E TECNOLOGIA SUL-RIO-GRANDENSE",IFSul,"INSTITUTO FEDERAL DE EDUCACAO, CIENCIA E TECNOLOGIA SUL-RIO-GRANDENSE - RS",Pública,1,4,Rua Gonçalves Chaves,3218,Centro,-,96015560.0
3221,FACULDADE DE CIÊNCIAS E EDUCAÇÃO SENA AIRES,FACESA,CENTRO TECNOLOGICO DE EDUCACAO SENA AIRES LTDA,Privada,4,3,Rua Acre Quadra 2,17/18,Chácaras  Anhanguera,-,72870508.0
3222,FACULDADE DE SANTA LUZIA,FACSAL,UNIESP S.A,Privada,5,3,Av. Beira Rio,2000,Distrito Industrial III,-,33040260.0
3223,FACULDADE DE TECNOLOGIA DE INDAIATUBA,FATEC-ID,CENTRO ESTADUAL DE EDUCACAO TECNOLOGICA PAULA SOUZA,Pública,2,3,Rua Dom Pedro I,65,Cidade Nova I,-,13334100.0
3224,FACULDADE DE TECNOLOGIA DE GUARATINGUETÁ,FATEC GT,CENTRO ESTADUAL DE EDUCACAO TECNOLOGICA PAULA SOUZA,Pública,2,3,Avenida Professor João Rodrigues Alckimin,1501,Jardim Esperança,-,12517010.0
3225,FACULDADE ENERGIA,,SOCIEDADE ENERGIA DE ENSINO SUPERIOR LTDA,Privada,4,3,Rua Saldanha Marinho,51,Centro,-,88010450.0
3226,UNIVERSIDADE DO VALE DO SAPUCAÍ,UNIVÁS,FUNDACAO DE ENSINO SUPERIOR DO VALE DO SAPUCAI,Privada,5,1,Avenida Coronel Alfredo Custódio Paula,320,Alfredo Custódio de Paula,-,37553068.0
3227,FACULDADES INTEGRADAS DE TANGARÁ DA SERRA,FITS,UNIC EDUCACIONAL LTDA,Privada,4,3,Avenida Vergilio Favetti,1200,Vila Alta,UNIDADE ADMINISTRATIVA e EDUCACIONAL,78300000.0
3228,CENTRO UNIVERSITÁRIO ESTÁCIO DE SÃO LUÍS,,UB UNISAOLUIS EDUCACIONAL S.A,Privada,4,2,Rua Grande / Oswaldo Cruz,1455,Diamante,-,65020250.0
3229,FACULDADE ESTÁCIO MACAPÁ - ESTÁCIO MACAPÁ,ESTÁCIO MACAPÁ,SOCIEDADE EDUCACIONAL DA AMAZONIA LTDA,Privada,5,3,Avenida José Tupinanbá de Almeida,1223,Jesus de Nazaré,-,68908126.0
3230,FACULDADE DE ODONTOLOGIA DE MANAUS,FOM,CENTRO DE ENSINO PESQUISA E POS-GRADUACAO DO NORTE,Privada,5,3,Rua Leovegildo Coelho,417,Centro,-,69005090.0
3231,FACULDADE SANTA FÉ,CESSF,CENTRO DE ENSINO SUPERIOR SANTA FE EIRELI,Privada,4,3,Avenida São Luís Rei de França,19,Bairro do Turu,"Lote de terreno próprio localizado entre a SL 7 e a MA 53, antiga estrada Olho D¿Água",65055285.0
3232,CENTRO UNIVERSITÁRIO PRESIDENTE TANCREDO DE ALMEIDA NEVES,UNIPTAN,IPTAN - INSTITUTO DE ENSINO SUPERIOR PRESIDENTE TANCREDO DE ALMEIDA NEVES S.A.,Privada,4,2,Avenida Leite de Castro,1.101,Fábricas,-,36301182.0
3233,INSTITUTO DE CIÊNCIAS DA SAÚDE,ICS,FUNORTE FACULDADES UNIDAS DO NORTE MINAS LTDA,Privada,5,3,Avenida Osmane Barbosa,11.111,JK,-,39404006.0
3234,FACULDADE CIDADE DE COROMANDEL,FCC,ASSOCIACAO EDUCACIONAL DE COROMANDEL - AEC,Privada,5,3,Avenida Adolfo Timóteo da Silva,433,Brasil Novo,-,38550000.0
3235,FACULDADE DE ADMINISTRAÇÃO DE NOVA ANDRADINA - FANOVA,FANOVA,ASSOCIACAO EDUCACIONAL DO CONE SUL,Privada,5,3,Avenida Antonio Joaquim de Moura Andrade,910,Centro,-,79750000.0
3236,FACULDADE LUTERANA SÃO MARCOS,FALSM,COMUNIDADE EVANGELICA LUTERANA SAO MARCOS,Privada,5,3,Rua Dr. Mario Totta,260,Vila Agritter,-,94820400.0
3237,FACULDADE DOS CERRADOS PIAUIENSES,FCP,SOCIEDADE DE ENSINO SUPERIOR DO SUL DO PIAUI S/C LTDA - ME,Privada,4,3,Avenida Desembargador Amaral,1835,Centro,-,64980970.0
3238,FACULDADE DAS ATIVIDADES EMPRESARIAIS DE TERESINA,FAETE,FUNDACAO EDUCACIONAL DA ASSOCIACAO COMERCIAL PIAUIENSE,Privada,5,3,Avenida Doutor Nicanor Barreto,4381,Vale Quem Tem,-,64057105.0
3239,FACULDADE EDUCACIONAL DE ARAPOTI,FATI,CENTRO DE ENSINO TECNOLOGICO E SUPERIOR SS LTDA - EPP,Privada,4,3,Rua das Rosas,1,Residencial Inpacel,-,84990000.0
3240,Faculdade Assis Gurgacz,FAG TOLEDO,FUNDACAO ASSIS GURGACZ,Privada,5,3,Avenida Ministro Cirne Lima,2.565,Jardim Coopagro,-,85903590.0
3241,INSTITUTO SUPERIOR DO LITORAL DO PARANÁ,ISULPAR,CAEDRHS - ASSOCIACAO DE ENSINO,Privada,5,3,Rua Coronel José Lobo,800,Costeira,-,83203310.0
3242,FACULDADE ANGEL VIANNA,FAV,FACULDADE ANGEL VIANNA,Privada,4,3,Rua Jornalista Orlando Dantas,2,Botafogo,-,22231010.0
3243,CENTRO UNIVERSITÁRIO SOCIESC DE BLUMENAU,,SOCIEDADE DE EDUCACAO SUPERIOR E CULTURA BRASIL S.A.,Privada,4,2,Rua Pandiá Calógeras,272,Jardim Blumenau,-,89010350.0
3244,FACULDADE DE OLÍMPIA,,UNIESP S.A,Privada,4,3,Rua Bruno Riscali,S/Nº,Vila Hípica,-,15400000.0
3245,FACULDADE SANTA RITA,FASAR,DORA RISCALA NEMI COSTA S/S LTDA - EPP,Privada,4,3,Rua Doutor Mário Florence,144,Jardim Aeroporto,-,14960000.0
3246,FACULDADE NETWORK,NWK,COLEGIO NET WORK S/S LTDA,Privada,4,3,Avenida Ampélio Gazzetta,2445,Lopes Iglesias,-,13460000.0
3247,FACULDADE DE CIÊNCIAS AGRÁRIAS DE ANDRADINA,FCAA,FUNDACAO EDUCACIONAL DE ANDRADINA,Privada,5,3,Rua Amazonas,571,Sttela Maris,-,16901160.0
3248,FACULDADE MARECHAL RONDON,FMR,ASSOCIACAO EDUCACIONAL NOVE DE JULHO,Privada,5,3,Viscinal Nilo Lisboa Chavasco,5000,Chacara Saltinho,-,18650000.0
3249,FACULDADE PITÁGORAS DE LONDRINA,,UNIAO DE ENSINO UNOPAR LTDA,Privada,4,3,Rua Edwy Taques de Araújo,900,Jardim Burle Marx,Pitágoras Catuaí,86047790.0
3250,FACULDADE DE CIÊNCIAS JURÍDICAS E SOCIAIS DE MACEIÓ,FAMA,ADMINISTRACAO ALAGOANA DE CURSO SUPERIOR LTDA,Privada,4,3,Rua Roberto Simonsen,s/n,Gruta de Lourdes,-,57052675.0
3251,CENTRO UNIVERSITÁRIO SOCIAL DA BAHIA,UNISBA,ASSOCIACAO BRASILEIRA DE EDUCACAO FAMILIAR E SOCIAL,Privada,5,2,Avenida Oceânica,2717,Ondina,-,40170110.0
3252,FACULDADE DE TECNOLOGIA E CIÊNCIAS DE ITABUNA,FTC,INSTITUTO MANTENEDOR DE ENSINO SUPERIOR DA BAHIA LTDA - ME,Privada,4,3,Praça José Bastos,55,Centro,-,45600080.0
3253,FACULDADE UNIME DE EDUCAÇÃO E COMUNICAÇÃO,FEC,EDITORA E DISTRIBUIDORA EDUCACIONAL S/A,Privada,4,3,Avenida Luiz Tarquínio Pontes,600,Centro,-,42702420.0
3254,FACULDADE DE TECNOLOGIA E CIÊNCIAS DE JEQUIÉ,FTC,INSTITUTO MANTENEDOR DE ENSINO SUPERIOR DA BAHIA LTDA - ME,Privada,4,3,Av Avenida Adolfo Ribeiro,357,São Judas Tadeu,-,45204068.0
3255,FACULDADE DE EDUCAÇÃO CIÊNCIAS E LETRAS DE PARAÍSO,FECIPAR,FUNDACAO EDUCACIONAL DE PARAISO DO TOCANTINS FEPAR,Pública,3,3,Rua L-20,S/N,Interlagos,-,77600000.0
3256,FACULDADE DE ENSINO E CULTURA DO CEARÁ,FAECE,ASCEC ENSINO SUPERIOR CEARENSE LTDA,Privada,4,3,Rua Caetano Ximenes Aragão,110,Engenheiro Luciano Cavalcante,Instituto de Ensino Superior do Ceará - IESC,60040531.0
3257,FACULDADE DE CIÊNCIA E EDUCAÇÃO DO CAPARAÓ,FACEC,SOCIEDADE EDUCACIONAL SUPERIOR LTDA,Privada,4,3,Avenida José Alexandre,713,Centro,-,29560000.0
3258,INSTITUTO DE ENSINO SUPERIOR DE TERESINA,IEST,AESPI ENSINO SUPERIOR DO PIAUI LTDA.,Privada,5,3,Rua Walfran Batista,91,São Cristóvão,Unidade Walfram,64046470.0
3259,CENTRO UNIVERSITÁRIO UNISEP,CEUUN,UNISEP-UNIAO DE ENSINO DO SUDOESTE DO PARANA S/C LTDA,Privada,4,2,Avenida Presidente Kennedy,2.601,Nossa Senhora Aparecida,-,85660000.0
3260,CENTRO UNIVERSITÁRIO DA GRANDE FORTALEZA,UNIGRANDE,CEUDESP - CENTRO DE EDUCACAO UNIVERSITARIO E DESENVOLVIMENTO PROFISSIONAL LTDA,Privada,4,2,Avenida Porto Velho,401,João XXIII,-,60520102.0
3261,CENTRO UNIVERSITÁRIO ESTÁCIO DE BRASÍLIA - ESTÁCIO BRASÍLIA,ESTÁCIO BRASÍLIA,IESST - INSTITUTO DE ENSINO SUPERIOR SOCIAL E TECNOLOGICO,Privada,4,2,CSG 09,Lotes 15/16,Taguatinga,TAGUATINGA,72035509.0
3262,Faculdade Projeção de Sobradinho,FAPRO,GUATAG - SOCIEDADE DE ASSISTENCIA EDUCACIONAL LTDA,Privada,5,3,Quadra 04 Área Reservada 01 - Região Administrativa V,s/n,Sobradinho,-,73025040.0
3263,Centro Universitário Araguaia,UNIARAGUAIA,SOCIEDADE DE EDUCACAO E CULTURA DE GOIAS S/C LTDA,Privada,4,2,Avenida T-10,1047,Setor Bueno,Unidade Bueno,74223060.0
3264,FACULDADE DA SAÚDE E ECOLOGIA HUMANA,FASEH,CENTRO DE ENSINO SUPERIOR DE VESPASIANO LTDA,Privada,4,3,Rua São Paulo,958,Jardim Alterosa,-,33200664.0
3265,CENTRO UNIVERSITÁRIO UNIHORIZONTES,,INSTITUTO NOVOS HORIZONTES DE ENSINO SUPERIOR E PESQUISA LTDA.,Privada,4,2,Rua Alvarenga Peixoto,1270,Santo Agostinho,SEDE -CAMPUS  - BELO HORIZONTE - SANTO AGOSTINHO,30180121.0
3266,INSTITUTO METROPOLITANO DE ENSINO SUPERIOR,IMES,UNIVACO - UNIAO EDUCACIONAL DO VALE DO ACO S.A.,Privada,4,3,Rua João Patrício Araújo,179,Veneza,-,35164251.0
3267,FACULDADE ASA DE BRUMADINHO,IECEMB - FAB,INSTITUICAO EDUCACIONAL CECILIA MARIA DE MELO BARCELOS LTDA,Privada,4,3,Rodovia Mg 040,Km 49,.,-,35460000.0
3268,CENTRO UNIVERSITÁRIO SÃO MIGUEL,UNISÃOMIGUEL,SOCIEDADE CULTURAL E EDUCACIONAL SANTA RITA DE CASSIA LTDA - ME,Privada,4,2,Edifício Portal da Boa Vista,130,Boa Vista,Campus Fernandes Vieira,50060001.0
3269,FACULDADE DE ENSINO SUPERIOR DO PIAUÍ,FAESPI,C VIEIRA SERVICOS - EPP,Privada,4,3,Rua Primeiro de Maio,2235,Primavera,-,64002510.0
3270,FACULDADE DE CAMPINA GRANDE DO SUL,FACSUL,SOCIEDADE DE ENSINO SUPERIOR DO LESTE DO PARANA LTDA - EPP,Privada,4,3,Rua Duilio Calderari,600,Jardim Paulista,-,83430000.0
3271,Faculdade Unirb - Mossoró,F. UNIRB,SOCIEDADE EDUCACIONAL MATER CHRISTI LTDA,Privada,4,3,Avenida Francisco Mota,3310,Presidente Costa e Silva,UNIRB MOSSORO NOVA SEDE,59625300.0
3272,FACULDADE SALESIANA MARIA AUXILIADORA,FSMA,INSTITUTO N S DA GLORIA,Privada,5,3,Rua Monte Elísio,s/n,Visconde de Araújo,-,27943200.0
3273,CENTRO UNIVERSITÁRIO MAURÍCIO DE NASSAU DE TERESINA,,CENTRO DE ENSINO SUPERIOR PIAUIENSE LTDA,Privada,4,2,Avenida Joquei Clube,710,Joquei Clube,-,64049240.0
3274,FACULDADE DE SÃO VICENTE,FSV,UNIAO BRASILEIRA EDUCACIONAL LTDA.,Privada,4,3,Avenida Capitão Mor Aguiar,798,Centro,-,11310200.0
3275,FACULDADE ITANHAÉM,FAITA,UNIDADE DE ENSINO SUPERIOR DE ITANHAEM LTDA,Privada,4,3,Avenida Embaixador Pedro de Toledo,196,Centro,-,11740000.0
3276,ESCOLA SUPERIOR DE CRICIÚMA - ESUCRI,ESUCRI,ESUCRI - ESCOLA SUPERIOR DE CRICIUMA LTDA,Privada,4,3,Rua Gonçalves Ledo,185,Centro,-,88802180.0
3277,FACULDADE CENTRAL DE CRISTALINA,FACEC,SOCIEDADE CENTRAL DE ENSINO SUPERIOR - EPP,Privada,4,3,Rua Getúlio Vargas,1.478,Centro,-,73850000.0
3278,CENTRO UNIVERSITÁRIO FACOL,UNIFACOL,"ASSOCIACAO VITORIENSE DE EDUCACAO, CIENCIAS E CULTURA - AVEC",Privada,5,2,Rua do Estudante,85,Universitário,-,55612285.0
3279,FACULDADE MACHADO DE ASSIS,FAMA,ASSOCIACAO EDUCACIONAL MACHADO DE ASSIS,Privada,5,3,Praça Marquês de Herval,4,Santa Cruz,-,23510140.0
3280,CENTRO UNIVERSITÁRIO ESTÁCIO DA AMAZÔNIA,ESTÁCIO AMAZÔNIA,SOCIEDADE EDUCACIONAL ATUAL DA AMAZONIA LTDA,Privada,4,2,Rua Jornalista Humberto Silva,308,União,-,69313792.0
3281,FACULDADE UNIBRAS DE GOIÁS,FACBRAS,ASSOCIACAO DE ENSINO SUPERIOR DE GOIAS-AESGO,Privada,5,3,Rua 12 de Outubro,40,Centro,-,75906577.0
3282,INSTITUTO PERNAMBUCANO DE ENSINO SUPERIOR,IPESU,APESU ENSINO SUPERIOR DE PERNAMBUCO LTDA,Privada,4,3,Rua São Miguel,176,Afogados,Afogados,50770720.0
3283,Centro Universitário Tiradentes de Pernambuco,UNIT PE,SOCIEDADE DE EDUCACAO TIRADENTES S.A,Privada,4,2,Rua Barão de São Borja - 421 ao fim - ímpar,427,Boa Vista,-,50070135.0
3284,FACULDADE ANHANGUERA DE NEGÓCIOS E TECNOLOGIAS DA INFORMAÇÃO,,ANHANGUERA EDUCACIONAL PARTICIPACOES S/A,Privada,4,3,Quadra QS 1 Rua 210,40,Taguatinga Sul,Salas 2031 A e B e Salas 2037 A e B,71950770.0
3285,FACULDADE DE PRESIDENTE PRUDENTE,FAPEPE,UNIESP S.A,Privada,4,3,Avenida Presidente Prudente,6093,Jardim Aeroporto,-,19053210.0
3286,FACULDADE DE CIÊNCIAS E TECNOLOGIA DE TERESINA,FACET,ASSOCIACAO PIAUIENSE DE ENSINO SUPERIOR LTDA - ME,Privada,4,3,Rua Areolino de Abreu,1941,Centro/Norte,-,64000180.0
3287,FACULDADE DE TECNOLOGIA DE SÃO VICENTE,FATEF,FORTEC ASSESSORIA E TREINAMENTO LTDA,Privada,4,3,Avenida Presidente Wilson,1013,Gonzaguinha,-,11320001.0
3288,ESCOLA SUPERIOR DE GESTÃO COMERCIAL E MARKETING,ESIC,ASSOCIACAO DEHONIANA BRASIL MERIDIONAL,Privada,5,3,Rua Padre Dehon,814,Hauer,-,81630090.0
3289,Faculdade de Imperatriz Wyden,Facimp Wyden,A. REGIAO TOCANTINA DE EDUCACAO E CULTURA LTDA.,Privada,4,3,Avenida Prudente de Moraes,s/n,Residencial Kubitschek,-,65914335.0
3290,FACULDADE NOBRE DE FEIRA DE SANTANA,FAN,GRUPO NOBRE DE ENSINO LTDA,Privada,4,3,Avenida Maria Quitéria,2116,Centro,- de 1902 a 2316 - lado par,44001008.0
3291,FACULDADE MINAS GERAIS,FAMIG,CESMIG - CENTRO DE ENSINO SUPERIOR MINAS GERAIS LTDA - ME,Privada,4,3,Avenida do Contorno,10185,Barro Preto,- de 9697 a 10195 - lado ímpar,30110067.0
3292,FACULDADE DE VIÇOSA,FDV,ASSOCIACAO VICOSENSE DE ENSINO E PESQUISA LTDA - AVEP - VICOSA - EPP,Privada,4,3,Rua Gomes Barbosa,870,Centro,-,36570101.0
3293,STRONG BUSINESS SCHOOL,,CENTRO DE ENSINO SUPERIOR STRONG,Privada,5,3,Avenida Industrial,1455,Jardim,ESCOLA SUPERIOR DE ADMINISTRAÇÃO E GESTÃO STRONG,9080510.0
3294,FACULDADE XV DE AGOSTO,FAQ,FACULDADES XV DE AGOSTO LTDA - EPP,Privada,4,3,Avenida Xv de Agosto,1210,Centro,-,13960000.0
3295,CENTRO UNIVERSITÁRIO SANTA AMÉLIA,SECAL,SOCIEDADE EDUCATIVA E CULTURAL AMELIA S/C LTDA - EPP,Privada,4,2,Rua Barão do Cerro Azul,827,Centro,Campus Barão do Cerro Azul,84010210.0
3296,FACULDADE INTERAMERICANA DE PORTO VELHO,UNIRON,UNIRON - UNIAO DAS ESCOLAS SUPERIORES DE RONDONIA LTDA.,Privada,4,3,Avenida Mamoré,1.520,Cascalheira,- de 1402 a 1520 - lado par,76813000.0
3297,Centro Universitário Facid Wyden,,YDUQS EDUCACIONAL LTDA.,Privada,4,2,Rua Veterinário Bugyja Brito,1354,Horto Florestal,-,64051210.0
3298,CENTRO UNIVERSITÁRIO DOUTOR LEÃO SAMPAIO,UNILEÃO,INSTITUTO LEAO SAMPAIO DE ENSINO UNIVERSITARIO LTDA,Privada,4,2,Avenida Padre Cícero,2830,Triângulo,-,63041040.0
3299,CENTRO UNIVERSITÁRIO LA SALLE DO RIO DE JANEIRO,UNILASALLE/RJ,ASSOCIACAO BRASILEIRA DE EDUCADORES LASSALISTAS,Privada,5,2,Rua Gastão Gonçalves,79,Santa Rosa,-,24240030.0
3300,FACULDADE UNIBRASÍLIA SUL,BRASÍLIA,CESCO - CENTRO DE ENSINO SUPERIOR DO CENTRO OESTE LTDA,Privada,5,3,Área Especial 34,s/n,Setor Central (Gama),Lado Leste,72405610.0
3301,FACULDADE DE TECNOLOGIA CARLOS DRUMMOND DE ANDRADE,CSET DRUMMOND,SOCIEDADE EDUCACIONAL SOIBRA S/S LTDA,Privada,4,3,Avenida São Miguel,4335,Ponte Rasa,Unidade Ponte Rasa,3620001.0
3302,Faculdade Interativa de São Paulo,FAISP,CENTRO EDUCACIONAL JOVEM APRENDIZ DO BRASIL,Privada,4,3,Rua Heloísa Penteado,327,Vila Esperança,-,3649010.0
3303,FACULDADE LUSO-BRASILEIRA,FALUB,ORGANIZACAO PERNAMBUCANA DE EDUCACAO CIENCIA E CULTURA,Privada,5,3,Avenida Congresso Eucarístico Internacional,1,Santa Cruz,- de 1/2 a 99998/99999,55811000.0
3304,FACULDADE DE ENFERMAGEM NOVA ESPERANÇA,FACENE,ESCOLA DE ENFERMAGEM NOVA ESPERANCA LTDA,Privada,4,3,Av. Frei Galvão,12,Gramame,-,58067695.0
3305,FACULDADE ASSOCIADA BRASIL,FAB,SOCIEDADE BRASILEIRA DE ENSINO SUPERIOR,Privada,5,3,Rua Tiquatira,243,Bosque da Saúde,-,4137111.0
3306,FACULDADE INDEPENDENTE DO NORDESTE,FAINOR,FAINOR FACULDADE INDEPENDENTE DO NORDESTE LTDA,Privada,4,3,Avenida Luís Eduardo Magalhães,1305,Candeias,CAMPUS  - VITÓRIA DA CONQUISTA - CANDEIAS,45028440.0
3307,FACULDADE PADRE JOÃO BAGOZZI,FACULDADE BAGOZZI,CONGREGACAO DOS OBLATOS DE SAO JOSE,Privada,5,3,Rua Caetano Marchesini,952,Portão,-,81070110.0
3308,FACULDADE DE TECNOLOGIA E NEGÓCIOS CARLOS DRUMMOND DE ANDRADE,,SOCIEDADE EDUCACIONAL SOIBRA S/S LTDA,Privada,4,3,Av. Penha de França,35,Penha,-,3606010.0
3309,FACULDADE DE TECNOLOGIA SENAI CHAPECÓ,SENAI,SERVICO NACIONAL DE APRENDIZAGEM INDUSTRIAL,Privada,5,3,Rua Frei Bruno,201 E,Parque das Palmeiras,-,89803785.0
3310,FACULDADE ESPÍRITO SANTENSE,UNICAPE,UNIAO CAPIXABA DE ENSINO,Privada,5,3,Rua São Jorge,2,Alto Laje,-,29151120.0
3311,Centro Universitário Fanor Wyden,UniFanor Wyden,YDUQS EDUCACIONAL LTDA.,Privada,4,2,Rua Antonio Gomes Guimarães,150,Dunas,Prédio,60325001.0
3312,CENTRO UNIVERSITÁRIO FAI,,UCEFF - UNIDADE CENTRAL DE EDUCACAO FAI FACULDADES LTDA,Privada,4,2,Rua Carlos Kummer,100,Universitário,Centro Universitário FAI,89896000.0
3313,FACULDADE EDUCACIONAL DE PONTA GROSSA,,EDITORA E DISTRIBUIDORA EDUCACIONAL S/A,Privada,4,3,Rua Tibúrcio Pedro Ferreira,55,Centro,-,84010090.0
3314,Centro Universitário Favip Wyden,UniFavip Wyden,SOCIEDADE DE EDUCACAO DO VALE DO IPOJUCA LTDA,Privada,4,2,Avenida Adjar da Silva Casé,800,Indianópolis,-,55024740.0
3315,Faculdade Anhanguera de Tecnologia de Jundiaí,,ANHANGUERA EDUCACIONAL PARTICIPACOES S/A,Privada,4,3,Rua do Retiro,3.000,Retiro,-,13209355.0
3316,CENTRO UNIVERSITÁRIO LEONARDO DA VINCI,UNIVINCI,SOCIEDADE EDUCACIONAL DO VALE DO ITAPOCU S/S LTDA.,Privada,4,2,Rodovia Br 280 Km 60,15885,Imigrantes,-,89270000.0
3317,FACULDADE AIEC,AIEC / FAAB,ASSOCIACAO INTERNACIONAL DE EDUCACAO CONTINUADA - AIEC,Privada,4,3,"SEPS 712/912, Conjunto A",s/n,Asa Sul,"UPIS, Campus 1, Bloco B, Térreo, Salas 5, 6 e 7",70390125.0
3318,FACULDADE HORIZONTINA,FAHOR,INSTITUICAO SINODAL DE ASSISTENCIA EDUCACAO E CULTURA,Privada,5,3,Avenida dos Ipês,565,Esq. Eldorado,Campus Arnoldo Schneider,98920000.0
3319,FACULDADE INTESP,INTESP,INSTITUTO TECNOLOGICO DO SUDOESTE PAULISTA SYLVESTRE FERRAZ EGREJA,Privada,5,3,Rua Deoclides da Silva Guidio,469,Centro,-,18950000.0
3320,FACULDADE DE CIÊNCIAS SOCIAIS APLICADAS,FACISA,FUNDACAO UNIVERSIDADE DO OESTE DE SANTA CATARINA,Privada,5,3,Rodovia Br 282 Km 528,S/N,Linha Limeira,-,89825000.0
3321,FACULDADE DE ADMINISTRAÇÃO E ARTES DE LIMEIRA,FAAL,PHD EDUCACIONAL LTDA - ME,Privada,4,3,Avenida Engenheiro Antonio Eugênio Lucato,2515,Vila Camargo,-,13486085.0
3322,FACULDADE CATUAÍ,ICES,AEC - ASSOCIACAO DE ENSINO DE CAMBE,Privada,4,3,Rua Bento Munhoz da Rocha Neto,210,Condomínio Residencial Castelo Branco,-,86186125.0
3323,FACULDADE DO SUL DA BAHIA,FASB,FUNDACAO FRANCISCO DE ASSIS,Privada,5,3,Rua Sagrada Família,120,Bela Vista,-,45990283.0
3324,FACULDADES LONDRINA,,UNIAO LONDRINENSE DE ENSINO LTDA,Privada,4,3,Avenida Anália Franco,750,Cervejaria,Esquina com Avenida São João,86039560.0
3325,Faculdade REGES de Realeza,,REDE GONZAGA DE ENSINO SUPERIOR - REGES,Privada,5,3,Rodovia Pr,281,Rodovia,Km 2,85770000.0
3326,FACULDADE DOM BOSCO DE UBIRATÃ,DOM BOSCO UBIRATÃ,FUNDACAO CULTURAL XINGU,Privada,5,3,Avenida Clodoaldo de Oliveira,1.117,Centro,-,85440000.0
3327,FACULDADE DE MAUÁ - FAMA,FAMA,UNIESP S.A,Privada,5,3,Rua Vitorino Dell'Antônia,349,Vila Noemia,-,9370570.0
3328,CENTRO UNIVERSITÁRIO DOS GUARARAPES,UNIFG,SOCEC- SOCIEDADE CAPIBARIBE DE EDUCACAO E CULTURA LTDA,Privada,4,2,Rua Comendador José Didier,27,Piedade,-,54400160.0
3329,"INSTITUTO FEDERAL DE EDUCAÇÃO, CIÊNCIA E TECNOLOGIA DO CEARÁ",IFCE,"INSTITUTO FEDERAL DE EDUCACAO, CIENCIA E TECNOLOGIA DO CEARA",Pública,1,4,Rua Jorge Dumar,1703,Jardim América,-,60410426.0
3330,"INSTITUTO FEDERAL DE EDUCAÇÃO, CIÊNCIA E TECNOLOGIA DO ESPÍRITO SANTO",IFES,INSTITUTO FEDERAL DE EDUCACAO CIENCIA E TECNOLOGIA DO ESPIRITO SANTO,Pública,1,4,Avenida Rio Branco,50,Santa Lucia,-,29056255.0
3331,"INSTITUTO FEDERAL DE EDUCAÇÃO, CIÊNCIA E TECNOLOGIA DE PERNAMBUCO",IFPE,"INSTITUTO FEDERAL DE EDUCACAO, CIENCIA E TECNOLOGIA DE PERNAMBUCO",Pública,1,4,Avenida Professor Luiz Freire,500,Curado,-,50740540.0
3332,"INSTITUTO FEDERAL DE EDUCAÇÃO, CIÊNCIA E TECNOLOGIA DE SÃO PAULO",IFSP,"INSTITUTO FEDERAL DE EDUCACAO, CIENCIA E TECNOLOGIA DE SAO PAULO",Pública,1,4,Rua Pedro Vicente,625,Canindé,-,1109010.0
3333,"INSTITUTO FEDERAL DE EDUCAÇÃO, CIÊNCIA E TECNOLOGIA DE GOIÁS",IFG,"INSTITUTO FEDERAL DE EDUCACAO, CIENCIA E TECNOLOGIA DE GOIAS",Pública,1,4,Avenida Assis Chateaubriand,1658,Setor Oeste,-,74130012.0
3334,"INSTITUTO FEDERAL DE EDUCAÇÃO, CIÊNCIA E TECNOLOGIA  DO AMAZONAS",IFAM,"INSTITUTO FEDERAL DE EDUCACAO, CIENCIA E TECNOLOGIA DO AMAZONAS",Pública,1,4,Avenida Sete de Setembro,1975,CENTRO,-,69020120.0
3335,"INSTITUTO FEDERAL DE EDUCAÇÃO, CIÊNCIA E TECNOLOGIA DO PARÁ",IFPA,"INSTITUTO FEDERAL DE EDUCACAO,CIENCIA E TECNOLOGIA DO PARA",Pública,1,4,Avenida João Paulo II,514,Castanheira,-,66840690.0
3336,INSTITUTO DE ENSINO SUPERIOR DE BAURU,IESB,UNIESP S.A,Privada,4,3,Rua Anhangüera,set./19,Vila Flores,-,17013190.0
3337,Faculdade Estácio de Curitiba,ESTÁCIO CURITIBA,"IREP SOCIEDADE DE ENSINO SUPERIOR, MEDIO E FUNDAMENTAL LTDA.",Privada,4,3,Av. Senador Souza Naves,1715,Cristo Rei,-,80050152.0
3338,FACULDADE PITÁGORAS DE BELO HORIZONTE,FPAS,PITAGORAS - SISTEMA DE EDUCACAO SUPERIOR SOCIEDADE LTDA,Privada,4,3,Rua Santa Madalena Sofia,25,Cidade Jardim,Unidade Cidade Acadêmica (SEDE),30380650.0
