IDInstituicao,NomeInstituicao,SiglaInstituicao,NomeMantenedora,RedeEnsino,TipoDeCategoriaAdministrativa,TIpoOrganizacaoAcademica,Endereco,NumEndereco,BairroEndereco,ComplementoEndereco,CEP
0,UNIVERSIDADE FEDERAL DE MATO GROSSO,UFMT,FUNDACAO UNIVERSIDADE FEDERAL DE MATO GROSSO,Pública,1,1,Avenida Fernando Correa da Costa,2367,Boa Esperança,Cidade Universitária,78060900.0
1,UNIVERSIDADE DE BRASÍLIA,UNB,FUNDACAO UNIVERSIDADE DE BRASILIA,Pública,1,1,Campus Universitário Darcy Ribeiro,s/n,Asa Norte,,70910900.0
2,UNIVERSIDADE FEDERAL DE SERGIPE,UFS,FUNDACAO UNIVERSIDADE FEDERAL DE SERGIPE,Pública,1,1,Avenida Marechal Rondon,s/n,Jardim Rosa Elze,,49100000.0
3,UNIVERSIDADE FEDERAL DO AMAZONAS,UFAM,FUNDACAO UNIVERSIDADE DO AMAZONAS,Pública,1,1,Av. Rodrigo Otávio,6200,Coroado II,Campus Universitário,69077000.0
4,UNIVERSIDADE FEDERAL DO PIAUÍ,UFPI,FUNDACAO UNIVERSIDADE FEDERAL DO PIAUI,Pública,1,1,Campus Universitário Ministro Petrônio Portela,s/n,Ininga,SG - 07,64049550.0
5,UNIVERSIDADE FEDERAL DE OURO PRETO,UFOP,UNIVERSIDADE FEDERAL DE OURO PRETO,Pública,1,1,Rua Diogo de Vasconcelos,122,Centro,,35400000.0
6,UNIVERSIDADE FEDERAL DE SÃO CARLOS,UFSCAR,FUNDACAO UNIVERSIDADE FEDERAL DE SAO CARLOS,Pública,1,1,Via Washington  Luis,Km 235,Monjolinho,S/Nº,13565905.0
7,UNIVERSIDADE FEDERAL DE VIÇOSA,UFV,UNIVERSIDADE FEDERAL DE VICOSA,Pública,1,1,Av. P.H. Rolfs,s/n,Campus Universitário,Campus Universitário,36570000.0
8,UNIVERSIDADE ESTADUAL DE LONDRINA,UEL,SECRET DE EST CIENCIA TECNOLOGIA E ENSINO SUPERIOR SETI,Pública,2,1,Rodovia Celso Garcia Cid Pr 445 Km 380,,Campus Universitário,UEL - CAMPUS UNIVERS,86057970.0
9,PONTIFÍCIA UNIVERSIDADE CATÓLICA DO PARANÁ,PUCPR,ASSOCIACAO PARANAENSE DE CULTURA - APC,Privada,5,1,Rua Imaculada Conceição,1155,Prado Velho,,80215901.0
10,UNIVERSIDADE CATÓLICA DE PERNAMBUCO,UNICAP,CENTRO DE EDUCACAO TECNICA E CULTURAL,Privada,5,1,Rua do Príncipe,526,Boa Vista,Campus Universitário,50050900.0
11,UNIVERSIDADE FEDERAL DO RIO GRANDE,FURG,UNIVERSIDADE FEDERAL DO RIO GRANDE - FURG,Pública,1,1,Av. Itália,S/N,Carreiros,KM - 8,96201900.0
12,UNIVERSIDADE DE CAXIAS DO SUL,UCS,FUNDACAO UNIVERSIDADE DE CAXIAS DO SUL,Privada,5,1,Rua Francisco Getúlio Vargas,1130,Petrópolis,Bloco A,95070560.0
13,UNIVERSIDADE DO VALE DO RIO DOS SINOS,UNISINOS,ASSOCIACAO ANTONIO VIEIRA,Privada,5,1,Av. Unisinos,950,Cristo Rei,,93022000.0
14,UNIVERSIDADE CATÓLICA DE PETRÓPOLIS,UCP,ASSOCIACAO FACULDADES CATOLICAS PETROPOLITANAS,Privada,5,1,Rua Benjamin Constant,213,Centro,,25610130.0
15,UNIVERSIDADE FEDERAL DE UBERLÂNDIA,UFU,UNIVERSIDADE FEDERAL DE UBERLANDIA,Pública,1,1,Avenida João Naves de Ávila,2121,Santa Mônica,,38400902.0
16,UNIVERSIDADE CATÓLICA DE PELOTAS,UCPEL,ASSOCIACAO PELOTENSE DE ASSISTENCIA E CULTURA,Privada,5,1,Rua Félix da Cunha,412,Centro,,96010000.0
17,PONTIFÍCIA UNIVERSIDADE CATÓLICA DE CAMPINAS,PUC-CAMPINAS,SOCIEDADE CAMPINEIRA DE EDUCACAO E INSTRUCAO,Privada,5,1,Rua Professor Doutor Euryclides de Jesus Zerbini,1516,Parque Rural Fazenda Santa Cândida,Gleba 1 - QT. 06422,13087571.0
18,UNIVERSIDADE DE PASSO FUNDO,UPF,FUNDACAO UNIVERSIDADE DE PASSO FUNDO,Privada,5,1,Upf Campus Passo Fundo - Campus I,s/nº,São José,BR 285 - KM 171,99001970.0
19,PONTIFÍCIA UNIVERSIDADE CATÓLICA DO RIO GRANDE DO SUL,PUCRS,UNIAO BRASILEIRA DE EDUCACAO E ASSISTENCIA,Privada,5,1,Av. Ipiranga,6681,Partenon,,90619900.0
20,UNIVERSIDADE PRESBITERIANA MACKENZIE,MACKENZIE,INSTITUTO PRESBITERIANO MACKENZIE,Privada,5,1,Rua da Consolação,896,Consolação,Campus São Paulo,1302907.0
21,UNIVERSIDADE FEEVALE,FEEVALE,ASSOCIACAO PRO ENSINO SUPERIOR EM NOVO HAMBURGO,Privada,5,1,Rodovia Rodovia ERS-239,nº 2755,Vila Nova,,93525075.0
22,UNIVERSIDADE ESTADUAL DE SANTA CRUZ,UESC,UNIVERSIDADE ESTADUAL DE SANTA CRUZ,Pública,2,1,KM 16 DA RODOVIA ILHÉUS ITABUNA,S/N,Salobrinho,,45662900.0
23,ESCOLA NACIONAL DE CIÊNCIAS ESTATÍSTICAS,ENCE,FUNDACAO INSTIT BRAS DE GEOGRAFIA E ESTATISTICA IBGE,Pública,1,3,Rua André Cavalcanti,106,Santa Teresa,,20231050.0
24,UNIVERSIDADE VALE DO RIO VERDE,UNINCOR,FUNDACAO COMUNITARIA TRICORDIANA DE EDUCACAO,Privada,5,1,Avenida Castelo Branco,82,Chacara das Rosas,,37417150.0
25,UNIVERSIDADE ESTADUAL DO CEARÁ,UECE,FUNDACAO UNIVERSIDADE ESTADUAL DO CEARA FUNECE,Pública,2,1,Av. Dr. Silas Munguba,1700,Serrinha,Campus Universitário,60740000.0
26,UNIVERSIDADE JOSÉ DO ROSÁRIO VELLANO,UNIFENAS,FUNDACAO DE ENSINO E TECNOLOGIA DE ALFENAS,Privada,5,1,Rodovia Mg 179 - Km 0,s/n,Campus Universitário,,37130000.0
27,UNIVERSIDADE ESTADUAL DE CIÊNCIAS DA SAÚDE DE ALAGOAS - UNCISAL,UNCISAL,UNIVERSIDADE ESTADUAL DE CIENCIAS DA SAUDE DE ALAGOAS - UNCISAL,Pública,2,1,Rua Jorge de Lima,113,Trapiche da Barra,,57010300.0
28,FACULDADE DE TECNOLOGIA DE SOROCABA,FATEC SO,CENTRO ESTADUAL DE EDUCACAO TECNOLOGICA PAULA SOUZA,Pública,2,3,AVENIDA ENGENHEIRO CARLOS REINALDO MENDES,2.015,ALTO DA BOA VISTA,,18013280.0
29,FACULDADE DE TECNOLOGIA DE SÃO PAULO,FATEC-SP,CENTRO ESTADUAL DE EDUCACAO TECNOLOGICA PAULA SOUZA,Pública,2,3,Praça Coronel Fernando Prestes,30,BOM RETIRO,,1124060.0
30,FACULDADE DE TECNOLOGIA DE AMERICANA,FATEC-AM,CENTRO ESTADUAL DE EDUCACAO TECNOLOGICA PAULA SOUZA,Pública,2,3,Rua Emílio de Menezes,s/n,Vila Amorim,,13469111.0
31,FACULDADE DE TECNOLOGIA RUBENS LARA,FATEC-BS,CENTRO ESTADUAL DE EDUCACAO TECNOLOGICA PAULA SOUZA,Pública,2,3,Avenida Bartolomeu de Gusmão 110 Fatec - Faculdade de Tecnólogia da Baixada Santista,110,Aparecida,,11045908.0
32,FACULDADE DE TECNOLOGIA DE JAHU,FATEC-JAHU,CENTRO ESTADUAL DE EDUCACAO TECNOLOGICA PAULA SOUZA,Pública,2,3,Rua Frei Galvão,S/N,JARDIM PEDRO OMETTO,,17212599.0
33,UNIVERSIDADE DO ESTADO DO PARÁ,UEPA,UNIVERSIDADE DO ESTADO DO PARA UEP,Pública,2,1,Travessa Djalma Dutra,S/N,Telégrafo Sem Fio,,66113010.0
34,UNIVERSIDADE DO ESTADO DA BAHIA,UNEB,UNIVERSIDADE DO ESTADO DA BAHIA,Pública,2,1,Rua Silveira Martins,2555,Cabula,,41150000.0
35,FUNDAÇÃO UNIVERSIDADE DO ESTADO DE SANTA CATARINA,UDESC,FUNDACAO UNIVERSIDADE DO ESTADO DE SC UDESC,Pública,2,1,Avenida Madre Benvenuta,1907,Itacorubi,Campus I,88035001.0
36,UNIVERSIDADE ESTADUAL DE GOIÁS,UEG,UNIVERSIDADE ESTADUAL DE GOIAS,Pública,2,1,"Rodovia BR-153, Km 98",S/N,Área Rural,,75132400.0
37,UNIVERSIDADE ESTADUAL DE CAMPINAS,UNICAMP,UNIVERSIDADE ESTADUAL DE CAMPINAS,Pública,2,1,Cidade Universitária,S/N,BARÃO GERALDO,,13083970.0
38,UNIVERSIDADE DE SÃO PAULO,USP,UNIVERSIDADE DE SAO PAULO,Pública,2,1,Rua da Reitoria,374,Butantã,,5508220.0
39,UNIVERSIDADE ESTADUAL PAULISTA JÚLIO DE MESQUITA FILHO,UNESP,UNIVERSIDADE ESTADUAL PAULISTA JULIO DE MESQUITA FILHO,Pública,2,1,Rua Quirino de Andrade,215,Centro,,1049010.0
40,UNIVERSIDADE ESTADUAL DE MARINGÁ,UEM,SECRET DE EST CIENCIA TECNOLOGIA E ENSINO SUPERIOR SETI,Pública,2,1,Avenida Colombo,5790,Zona 7,Campus Universitário,87020900.0
41,FACULDADE DE DIREITO DE SÃO BERNARDO DO CAMPO,FDSBC,FACULDADE DE DIREITO DE SAO BERNARDO DO CAMPO,Pública,3,3,Rua Java,425,JARDIM DO MAR,,9750650.0
42,FACULDADE DE DIREITO DE FRANCA,FDF,FACULDADE DE DIREITO DE FRANCA,Pública,3,3,Avenida Major Nicácio,2377,SÃO JOSÉ,,14401135.0
43,CENTRO UNIVERSITÁRIO MUNICIPAL DE FRANCA,UNI-FACEF,CENTRO UNIVERSITARIO MUNICIPAL DE FRANCA,Especial,7,2,Avenida Major Nicácio,2433,SÃO JOSÉ,,14401135.0
44,ESCOLA DE ENGENHARIA DE PIRACICABA,EEP/FUMEP,FUNDACAO MUNICIPAL DE ENSINO DE PIRACICABA,Pública,3,3,Avenida Monsenhor Martinho Salgot,560,Areião,,13414040.0
45,FACULDADE DE FILOSOFIA CIÊNCIAS E LETRAS DE PENÁPOLIS,FAFIPE,FUNDACAO EDUCACIONAL DE PENAPOLIS,Pública,3,3,AV SÃO JOSÉ,400,VILA MARTINS,,16300000.0
46,UNIVERSIDADE DO ESTADO DO RIO GRANDE DO NORTE,UERN,UNIVERSIDADE DO ESTADO DO RIO GRANDE DO NORTE - UERN,Pública,2,1,Rua Almino Afonso,478,CENTRO,SEDE DA REITORIA,59610210.0
47,FACULDADE DE FORMAÇÃO DE PROFESSORES DA MATA SUL,FAMASUL,AUTARQUIA EDUCACIONAL DA MATA SUL,Especial,7,3,Br 101 Km 186 Sul,S/N,ENGENHO SAO MANOEL,,55540000.0
48,CENTRO DE ENSINO SUPERIOR DE ARCOVERDE,CESA,AUTARQUIA DE ENSINO SUPERIOR DE ARCOVERDE,Especial,7,3,Rua Gumercindo Cavalcanti,420,SÃO CRISTOVÃO,PREDIO,56512902.0
49,FACULDADE DE FILOSOFIA CIÊNCIAS E LETRAS DE SÃO JOSÉ DO RIO PARDO,FFCL,FACULDADE DE FILOS CIENC E LETRAS DE S J DO RIO PARDO,Pública,3,3,Rua Jorge Tibiriça,451,CENTRO,,13720000.0
50,UNIVERSIDADE REGIONAL DE BLUMENAU,FURB,FUNDACAO UNIVERSIDADE REGIONAL DE BLUMENAU,Pública,3,1,Rua Antonio da Veiga,140,Victor Konder,,89012900.0
51,FACULDADE DE FILOSOFIA CIÊNCIAS E LETRAS DE ALEGRE,FAFIA,PREFEITURA MUNICIPAL DE ALEGRE,Pública,3,3,Rua Belo Amorim,100,Centro,,29500000.0
52,INSTITUTO MUNICIPAL DE ENSINO SUPERIOR DE CATANDUVA,IMES CATANDUVA,INSTITUTO MUNICIPAL DE ENSINO SUPERIOR DE CATANDUVA,Pública,3,3,Av. Daniel Dalto S/N,S/N,Rural,Rodovia Washington L,15800970.0
53,CENTRO UNIVERSITÁRIO PARA O DESENVOLVIMENTO DO ALTO VALE DO ITAJAÍ,UNIDAVI,FUNDACAO UNIVERSIDADE PARA O DESENVOLVIMENTO DO ALTO VALE DO ITAJAI - UNIDAVI -,Privada,5,2,Rua Dr. Guilherme Gemballa,13,Jardim América,,89160000.0
54,UNIVERSIDADE DA REGIÃO DE JOINVILLE,UNIVILLE,FUNDACAO EDUCACIONAL DA REGIAO DE JOINVILLE,Privada,5,1,Rua Paulo Malschitzki,10,Campus Universitário - Zona Industrial,CAMPUS JOINVILLE - B,89219710.0
55,UNIVERSIDADE DO OESTE DE SANTA CATARINA,UNOESC,FUNDACAO UNIVERSIDADE DO OESTE DE SANTA CATARINA,Privada,5,1,Rua Getúlio Vargas,2125,Flor da Serra,,89600000.0
56,UNIVERSIDADE DO VALE DO ITAJAÍ,UNIVALI,FUNDACAO UNIVERSIDADE DO VALE DO ITAJAI,Privada,5,1,Rua Uruguai,458,Centro,UNIVALI - Universida,88302901.0
57,FACULDADE DE FILOSOFIA CIÊNCIAS E LETRAS DE MACAÉ,FAFIMA,FUNDACAO EDUCACIONAL LUIZ REID,Privada,5,3,Rua Tenente Rui Lopes Ribeiro,200,Centro,,27910340.0
58,CENTRO UNIVERSITÁRIO DE BRUSQUE,UNIFEBE,FUNDACAO EDUCACIONAL DE BRUSQUE FEBE,Privada,5,2,Rua Dorval Luz,123,Santa Terezinha,-,88352400.0
59,FACULDADE DE MEDICINA DE JUNDIAÍ,FMJ,PREFEITURA DO MUNICIPIO DE JUNDIAI,Pública,3,3,Rua Francisco Telles,250,VILA ARENS,,13202550.0
60,ESCOLA SUPERIOR DE EDUCAÇÃO FÍSICA DE JUNDIAÍ,ESEFJ,PREFEITURA DO MUNICIPIO DE JUNDIAI,Pública,3,3,Rua Rodrigo Soares de Oliveira,S/N,ANHANGABAU,,13208120.0
61,UNIVERSIDADE ESTADUAL VALE DO ACARAÚ,UVA,UNIVERSIDADE ESTADUAL VALE DO ACARAU,Pública,2,1,AVENIDA DA UNIVERSIDADE,850,BETÁNIA,,62040370.0
62,FACULDADE DE DIREITO DE CONSELHEIRO LAFAIETE,FDCL,FUNDACAO MUNICIPAL DE ENSINO SUPERIOR DE CONS LAFAIETE,Privada,5,3,Rua Lopes Franco,1001,Carijós,Blocos C / D,36400000.0
63,UNIVERSIDADE FEDERAL DE SÃO JOÃO DEL REI,UFSJ,UNIVERSIDADE FEDERAL DE SAO JOAO DEL-REI,Pública,1,1,Praça Frei Orlando,170,Centro,,36307352.0
64,FACULDADES INTEGRADAS RUI BARBOSA,FIRB,UNIVERSIDADE BRASIL,Privada,5,3,Rua Rodrigues Alves,756,Centro,,16900900.0
65,UNIVERSIDADE DE ARARAQUARA,UNIARA,ASSOCIACAO SAO BENTO DE ENSINO,Privada,5,1,Rua Voluntários da Pátria,1309,Centro,,14801320.0
66,CENTRO UNIVERSITÁRIO DE ARARAS -,UNAR,ASSOCIACAO EDUCACIONAL DE ARARAS,Privada,5,2,Avenida Ernani Lacerda de Oliveira,100,Parque Santa Cândida,,13603112.0
67,INSTITUTO NACIONAL DE TELECOMUNICAÇÕES,INATEL,FUNDACAO INSTITUTO NACIONAL DE TELECOMUNICACOES,Privada,5,3,Avenida João de Camargo,510,Centro,,37540000.0
68,FACULDADE DE EDUCAÇÃO FÍSICA DE BARRA BONITA,FAEFI,SISTEMA EDUCACIONAL SANTA MONICA LTDA,Privada,4,3,Rua João Gerin,275,Vila Operária,,17340000.0
69,CENTRO UNIVERSITÁRIO CLARETIANO,CEUCLAR,ACAO EDUCACIONAL CLARETIANA,Privada,5,2,Rua Dom Bosco,466,Castelo,,14300172.0
70,CENTRO UNIVERSITÁRIO SAGRADO CORAÇÃO,UNISAGRADO,INSTITUTO DAS APOSTOLAS DO SAGRADO CORACAO DE JESUS,Privada,5,2,Rua Irmã Arminda,out/50,Jardim Brasil,,17011160.0
71,CENTRO UNIVERSITÁRIO BARÃO DE MAUÁ,CBM,ORGANIZACAO EDUCACIONAL BARAO DE MAUA,Privada,5,2,Rua Ramos de Azevedo,423,Jardim Paulista,,14090180.0
72,FACULDADE DE CIÊNCIAS ECONÔMICAS DO TRIÂNGULO MINEIRO,FCETM,ASSOCIACAO EDUCACIONAL DR. ODILON FERNANDES,Privada,5,3,Rua Ronam Martins Marquez,487,Universitário,,38050600.0
73,UNIVERSIDADE DE VASSOURAS,,FUNDACAO EDUCACIONAL SEVERINO SOMBRA,Privada,5,1,AVENIDA EXPEDICIONÁRIO OSWALDO DE ALMEIDA RAMOS,280,CENTRO,BLOCO 7,27700000.0
74,FACULDADE DE DIREITO DE VARGINHA - FADIVA,FADIVA,FUNDACAO EDUCACIONAL DE VARGINHA,Privada,5,3,Rua José Gonçalves Pereira,112,VILA PINTO,,37010500.0
75,CENTRO UNIVERSITÁRIO DO TRIÂNGULO,UNITRI,ASSOCIACAO SALGADO DE OLIVEIRA DE EDUCACAO E CULTURA,Privada,5,2,Av.  Nicomedes Alves dos Santos,4545,Gávea,,38411106.0
76,UNIVERSIDADE DE UBERABA,UNIUBE,SOCIEDADE EDUCACIONAL UBERABENSE,Privada,5,1,"Av. Nene Sabino, 1801, Santa Marta.",1.801,Universitário,Campus Universitário,38055550.0
77,FACULDADE DE CIÊNCIAS HUMANAS DE OLINDA,FACHO,ASSOCIACAO INSTRUTORA MISSIONARIA,Privada,5,3,"Rodovia PE 15, KM 3.6",S/N,Ouro Preto,,53330740.0
78,CENTRO UNIVERSITÁRIO DE RIO PRETO,UNIRP,SOCIEDADE DE EDUCACAO E CULTURA DE SAO JOSE DO RIO PRETO LTDA.,Privada,4,2,Rua Yvette Gabriel Atique,45,Boa Vista,Unidade SEDE,15025400.0
79,FACULDADE DE MEDICINA DE SÃO JOSÉ DO RIO PRETO,FAMERP,ESTADO DE SAO PAULO,Pública,2,3,Avenida Brigadeiro Faria Lima,5416,VILA SÃO PEDRO,,15090000.0
80,UNIVERSIDADE DE SOROCABA,UNISO,FUNDACAO DOM AGUIRRE,Privada,5,1,Rodovia Raposo Tavares,S/N,Jardim Novo Eldorado,"Km 92,5",18023000.0
81,ESCOLA DE ADMINISTRAÇÃO DE EMPRESAS DE SÃO PAULO,FGV-EAESP,FUNDACAO GETULIO VARGAS,Privada,5,3,Avenida 9 de Julho,2029,Bela Vista,,1313902.0
82,FACULDADE DE CIÊNCIAS CONTÁBEIS,FACIC,FUNDACAO VISCONDE DE CAIRU,Privada,5,3,Rua Salete,50,Barris,,40070200.0
83,CONSERVATÓRIO BRASILEIRO DE MÚSICA - CENTRO UNIVERSITÁRIO BRASILEIRO DE EDUCAÇÃO,CBM-UniCBE,SOCIEDADE CIVIL CONSERVATORIO BRASILEIRO DE MUSICA,Privada,5,2,Avenida Graça Aranha,57,Castelo,12º Andar,20030002.0
84,FACULDADE DE FILOSOFIA CIÊNCIAS E LETRAS DE CARUARU,FAFICA,ASSOCIACAO DIOCESANA DE ENSINO E CULTURA DE CARUARU,Privada,5,3,Rua Azevedo Coutinho,s/n,Petrópolis,Térreo,55030902.0
85,FACULDADE FRASSINETTI DO RECIFE,FAFIRE,CONGREGACAO DE SANTA DOROTEIA DO BRASIL,Privada,5,3,Avenida Conde da Boa Vista,921,Boa Vista,,50060002.0
86,CENTRO UNIVERSITÁRIO ASSUNÇÃO,UNIFAI,FUNDACAO SAO PAULO,Privada,5,2,Rua Afonso Celso,671/711,Vila Mariana,- de 631/632 a 1029/,4119060.0
87,CENTRO UNIVERSITÁRIO BELAS ARTES DE SÃO PAULO,FEBASP,FEBASP ASSOCIACAO CIVIL,Privada,5,2,Rua Dr. Álvaro Alvim,76/90,Vila Mariana,,4018010.0
88,UNIVERSIDADE ESTÁCIO DE SÁ,UNESA,SOCIEDADE DE ENSINO SUPERIOR ESTACIO DE SA LTDA,Privada,4,1,Av. das Américas,4.200,Barra da Tijuca,BARRA I -TOM JOBIM,22640102.0
89,UNIVERSIDADE VEIGA DE ALMEIDA,UVA,ANTARES EDUCACIONAL S.A.,Privada,4,1,Rua Ibituruna,108,Tijuca,Unidade SEDE,20271901.0
90,"FAI - CENTRO DE ENSINO SUPERIOR EM GESTÃO, TECNOLOGIA E EDUCAÇÃO",,FUNDACAO EDUCANDARIO SANTARRITENSE,Privada,5,3,Av. Antonio de Cássia,472,Jardim Santo Antonio,,37540000.0
91,UNIVERSIDADE METODISTA DE SÃO PAULO,UMESP,INSTITUTO METODISTA DE ENSINO SUPERIOR,Privada,5,1,Rua do Sacramento,230,Rudge Ramos,,9640000.0
92,FUNVIC - FACULDADE FUNVIC DE MOCOCA,,FUNDACAO UNIVERSITARIA VIDA CRISTA,Privada,5,3,Avenida Monsenhor Demosthenes Paraná Brasil Pontes,2131,Conjunto Habitacional Gilberto Rossetti,,13737632.0
93,FACULDADE DE DIREITO DO SUL DE MINAS,FDSM,FUNDACAO SUL MINEIRA DE ENSINO,Privada,5,3,Avenida Doutor João Beraldo,1075,Centro,,37550000.0
94,UNIVERSIDADE CASTELO BRANCO,UCB,CENTRO EDUCACIONAL DE REALENGO,Privada,5,1,Avenida Santa Cruz,1631,Realengo,,21710250.0
95,ESCOLA DE MEDICINA SOUZA MARQUES DA FUNDAÇÃO TÉCNICO-EDUCACIONAL SOUZA MARQUES,EMSM,FUNDACAO TECNICO EDUCACIONAL SOUZA MARQUES,Privada,5,3,Avenida Ernani Cardoso,335,Cascadura,,21310310.0
96,FACULDADE DE CIÊNCIAS CONTÁBEIS E DE ADMINISTRAÇÃO DE EMPRESAS,FCCAE,FUNDACAO TECNICO EDUCACIONAL SOUZA MARQUES,Privada,5,3,Avenida Ernani Cardoso,335,Cascadura,,21310310.0
97,FACULDADE DE FILOSOFIA CIÊNCIAS E LETRAS SOUZA MARQUES,FFCLSM,FUNDACAO TECNICO EDUCACIONAL SOUZA MARQUES,Privada,5,3,AVENIDA ERNANI CARDOSO,335/345,Cascadura,,21310310.0
98,FACULDADE DE ENGENHARIA SOUZA MARQUES,FESM,FUNDACAO TECNICO EDUCACIONAL SOUZA MARQUES,Privada,5,3,Avenida Ernani Cardoso,335/345,Cascadura,,21310310.0
99,ESCOLA DE ENFERMAGEM DA FUNDAÇÃO TÉCNICO EDUCACIONAL SOUZA MARQUES,EEFTESM,FUNDACAO TECNICO EDUCACIONAL SOUZA MARQUES,Privada,5,3,Avenida Ernani Cardoso,335/345,Cascadura,,21310310.0
100,FACULDADE PRESBITERIANA MACKENZIE RIO,,INSTITUTO PRESBITERIANO MACKENZIE,Privada,5,3,Rua Buenos Aires,283,Centro,Suplementar rua Rege,20061003.0
101,FACULDADE DE EDUCAÇÃO SUPERIOR DO PARANÁ,FESPPR,FUNDACAO DE ESTUDOS SOCIAIS DO PARANA,Privada,5,3,Rua General Carneiro,216,Centro,Térreo,80060150.0
102,FACULDADE CÁSPER LÍBERO,FCL,FUNDACAO CASPER LIBERO,Privada,5,3,Avenida Paulista,900,Bela Vista,5º Andar,1310940.0
103,FACULDADE DO RIO DE JANEIRO,,UNIESP S.A,Privada,4,3,Rua General Caldwell,189/197,Centro,,20230192.0
104,UNIVERSIDADE SÃO JUDAS TADEU,USJT,AMC - SERVICOS EDUCACIONAIS LTDA,Privada,4,1,Rua Taquari,546,Mooca,,3166000.0
105,CENTRO UNIVERSITÁRIO ÍTALO-BRASILEIRO,UNIÍTALO,INSTITUICAO EDUCACIONAL PROFESSOR PASQUALE CASCINO,Privada,5,2,Avenida João Dias,2046,Santo Amaro,,4724003.0
106,CENTRO UNIVERSITÁRIO MOURA LACERDA,CUML,INSTITUICAO UNIVERSITARIA MOURA LACERDA,Privada,5,2,Rua Padre Euclides,995,Campos Elísios,,14085420.0
107,UNIVERSIDADE DE RIBEIRÃO PRETO,UNAERP,ASSOCIACAO DE ENSINO DE RIBEIRAO PRETO,Privada,5,1,Avenida Costábile Romano,2201,Ribeirânia,Associação de Ensino,14096900.0
108,CENTRO UNIVERSITÁRIO ÁLVARES PENTEADO,FECAP,FUNDACAO ESCOLA DE COMERCIO ALVARES PENTEADO - FECAP,Privada,5,2,Avenida da Liberdade,532,Liberdade,Bloco C,1502001.0
109,FACULDADE DE ENGENHARIA DE MINAS GERAIS - FEAMIG,FEAMIG,INSTITUTO EDUCACIONAL CANDIDA DE SOUZA,Privada,5,3,Rua Gastão Braúlio dos Santos,837,Gameleira,,30510120.0
110,CENTRO UNIVERSITÁRIO METODISTA IZABELA HENDRIX,CEUNIH,INSTITUTO METODISTA IZABELA HENDRIX,Privada,5,2,Rua da Bahia,2.020,Funcionários,,30160012.0
111,CENTRO UNIVERSITÁRIO DAS FACULDADES ASSOCIADAS DE ENSINO - FAE,UNIFAE,CENTRO UNIVERSITARIO DAS FACULDADES ASSOCIADAS DE ENSINO-FAE,Especial,7,2,Largo Engenheiro Paulo de Almeida Sandeville,15,JARDIM SANTO ANDRÉ,,13870377.0
112,FACULDADE DE EDUCAÇÃO CIÊNCIAS E ARTES DOM BOSCO DE MONTE APRAZÍVEL,FAECA DOM BOSCO,ASSOCIACAO DE ENSINO DOM BOSCO DE MONTE APRAZIVEL,Privada,5,3,Rua Augusto Chiesa,679,Centro,,15150000.0
113,FACULDADE SÃO JUDAS TADEU,FSJT,ASSOCIACAO DE ENSINO SUPERIOR SAO JUDAS TADEU,Privada,5,3,Rua Clarimundo de Melo,79,Encantado,,20740321.0
114,UNIVERSIDADE CRUZEIRO DO SUL,UNICSUL,CRUZEIRO DO SUL EDUCACIONAL S.A.,Privada,4,1,Avenida Doutor Ussiel Cirilo,225,São Miguel,Vila Jacuí,8060070.0
115,CENTRO UNIVERSITÁRIO DE VOTUPORANGA,UNIFEV,FUNDACAO EDUCACIONAL DE VOTUPORANGA,Privada,5,2,Rua Pernambuco,4196,Patrimônio Novo,- de 2564/2565 ao fi,15500006.0
116,Centro Universitário Saúde ABC,CUSABC,FUNDACAO DO ABC,Privada,5,2,Avenida Príncipe de Gales,821,Príncipe de Gales,,9060650.0
117,FACULDADE DE SANTO ANDRÉ,,UNIESP S.A,Privada,5,3,Rua Siqueira Campos,483,Centro,SEDE,9020240.0
118,CENTRO UNIVERSITÁRIO LUSÍADA,UNILUS,FUNDACAO LUSIADA,Privada,5,2,Armando de Salles Oliveira,150,Boqueirão,,11050071.0
119,UNIVERSIDADE CATÓLICA DE SANTOS,UNISANTOS,SOCIEDADE VISCONDE DE S LEOPOLDO,Privada,5,1,Avenida Conselheiro Nébias,300,Vila Mathias,,11015002.0
120,FACULDADE DE SÃO BERNARDO DO CAMPO - FASB,FASB I,FUNDACAO EDUCACIONAL JOAO RAMALHO,Privada,5,3,Rua Américo Brasiliense,449,Centro,,9715020.0
121,FACULDADES OSWALDO CRUZ,FOC,INSTITUTO EDUCACIONAL OSWALDO QUIRINO LTDA,Privada,4,3,Rua Brigadeiro Galvão,540,Barra Funda,,1151000.0
122,UNIVERSIDADE SANTA ÚRSULA,USU,ASSOCIACAO UNIVERSITARIA SANTA URSULA,Privada,5,1,Rua Fernando Ferrari,75,Botafogo,,22231040.0
123,CENTRO UNIVERSITÁRIO ANHANGUERA DE SANTO ANDRÉ,UNIA,ANHANGUERA EDUCACIONAL PARTICIPACOES S/A,Privada,4,2,Rua Senador Flaquer,456/459,Centro,,9010160.0
124,FACULDADE DO CLUBE NÁUTICO MOGIANO,FCNM,CLUBE NAUTICO MOGIANO,Privada,5,3,Rua Cabo Diogo Oliver,758,Mogilar,,8773000.0
125,CENTRO UNIVERSITÁRIO FIEO,UNIFIEO,FUNDACAO INSTITUTO DE ENSINO PARA OSASCO,Privada,5,2,AV FRANZ VOEGELI,300,VILA YARA,CAMPUS VILA YARA,6020190.0
126,CENTRO UNIVERSITÁRIO UNI-BAN,UNI-BAN,UNIAO BANDEIRANTE DE EDUCACAO E CULTURA S.A.,Privada,4,2,Rua Maria Cândida,1789,Vila Guilherme,Nova Sede UNI-BAN,2071013.0
127,FACULDADE DE ENGENHARIA E AGRIMENSURA DE PIRASSUNUNGA - FEAP,FEAP,ASSOCIACAO UNIFICADA PIRASSUNUGUENSE ENSINO SUPERIOR,Privada,5,3,Avenida dos Acadêmicos,1,Posto de Monta,,13630974.0
128,FACULDADES INTEGRADAS CAMPOS SALLES,FICS,ASSOCIACAO EDUCATIVA CAMPOS SALLES,Privada,5,3,Rua Nossa Senhora da Lapa,284,Lapa,,5072000.0
129,CENTRO UNIVERSITÁRIO DAS FACULDADES INTEGRADAS DE OURINHOS,Unifio,FUNDACAO EDUCACIONAL MIGUEL MOFARREJ,Privada,5,2,"Rodovia BR-153, Km 399 + 420 m",s/n,Água do Cateto,,19909100.0
130,UNIVERSIDADE METODISTA DE PIRACICABA,UNIMEP,INSTITUTO EDUCACIONAL PIRACICABANO DA IGREJA METODISTA,Privada,5,1,Rodovia do Açúcar,s/n,Taquaral,CAMPUS  - PIRACICABA,13400911.0
131,CENTRO UNIVERSITÁRIO ESPÍRITO-SANTENSE/FAESA,,FUNDACAO DE ASSISTENCIA E EDUCACAO - FAESA,Privada,5,2,Rua Anselmo Serrat,199,Ilha de Monte Belo,,29053250.0
132,FACULDADE FACCAT,FACCAT,ORGANIZACAO EDUCACIONAL ARTUR FERNANDES LTDA,Privada,4,3,Rua Cherentes,36,Centro,Térreo e  Superior,17600090.0
133,FACULDADE DE TUPÃ,,UNIESP S.A,Privada,4,3,Rua Mandaguaris,274,Centro,Térreo,17600060.0
134,UNIVERSIDADE DO OESTE PAULISTA,UNOESTE,ASSOCIACAO PRUDENTINA DE EDUCACAO E CULTURA APEC,Privada,5,1,Rua José Bongiovani,700,Cidade Universitária,Campus Universitário,19050900.0
135,UNIVERSIDADE DO VALE DO PARAÍBA,UNIVAP,FUNDACAO VALEPARAIBANA DE ENSINO,Privada,5,1,"Av. Shishima Hifumi, nº 2911, Bairro Urbanova",2911,Urbanova,,12244000.0
136,FACULDADE DE DIREITO DE SOROCABA,FADI,FUNDACAO EDUCACIONAL SOROCABANA FAC DIREITO DE SOROCABA,Privada,5,3,Rua Doutora Ursulina Lopes Torres,123,Vergueiro,,18030103.0
137,CENTRO UNIVERSITÁRIO AUGUSTO MOTTA,UNISUAM,SOCIEDADE UNIFICADA DE ENSINO AUGUSTO MOTTA,Privada,5,2,Avenida Paris,84,Bonsucesso,,21041020.0
138,FACULDADES INTEGRADAS SIMONSEN,FIS,ORGANIZACAO BRASILEIRA DE CULTURA E EDUCACAO ORBRACE,Privada,5,3,Rua Ibitiuva,151,Padre Miguel,,21715400.0
139,FACULDADES INTEGRADAS HÉLIO ALONSO,FACHA,ORGANIZACAO HELIO ALONSO DE EDUCACAO E CULTURA OHAEC,Privada,5,3,Rua Muniz Barreto,51,Botafogo,,22251090.0
140,FACULDADE DE MEDICINA DE ITAJUBÁ,FMIT,CENTRO DE CIENCIAS EM SAUDE DE ITAJUBA S.A,Privada,5,3,AV.  RENNO JUNIOR,368,SÃO VICENTE,,37502138.0
141,FACULDADE DE DIREITO DO VALE DO RIO DOCE,FADIVALE,SOCIEDADE SIMPLES CULTURA E EDUCACAO,Privada,5,3,Rua Artur Bernardes,533,Centro,Prédio,35010090.0
142,FACULDADE TRÊS DE MAIO,SETREM,SOCIEDADE EDUCACIONAL TRES DE MAIO,Privada,5,3,Avenda Santa Rosa,2.405,Centro,,98910000.0
143,UNIVERSIDADE DE SANTA CRUZ DO SUL,UNISC,ASSOCIACAO PRO ENSINO EM SANTA CRUZ DO SUL,Privada,5,1,Avenida Independência,2293,Universitário,,96815900.0
144,Centro Universitário da Região da Campanha,,FUNDACAO ATTILA TABORDA,Privada,5,2,Avenida Tupy Silveira,2099,Centro,CAMPUS - BAGÉ - CENT,96400110.0
145,UNIVERSIDADE PITÁGORAS UNOPAR,,EDITORA E DISTRIBUIDORA EDUCACIONAL S/A,Privada,4,1,Avenida Paris,675,Parque Residencial João Piza,,86041120.0
146,FACULDADE DE JANDAIA DO SUL,FAFIJAN,FUNDACAO EDUCACIONAL JANDAIA DO SUL,Privada,5,3,Rua Dr. João Maximiano,426,Centro,Térreo,86900000.0
147,FACULDADE DIVINÓPOLIS,FACED,SOCIEDADE DE EDUCACAO SUPERIOR E CULTURA - SOCIESC S.A.,Privada,4,3,Praça do Mercado,191,Centro,,35500048.0
148,FACULDADE DE MEDICINA DE BARBACENA,FAME,FUNDACAO JOSE BONIFACIO LAFAYETTE DE ANDRADA,Privada,5,3,Praça Presidente Antônio Carlos,8,São Sebastião,,36202336.0
149,CENTRO UNIVERSITÁRIO PRESIDENTE ANTÔNIO CARLOS,UNIPAC,FUNDACAO PRESIDENTE ANTONIO CARLOS,Privada,5,2,Rodovia BR-338,s/n,Colônia Rodrigo Silva,"- do km 10,000 ao km",36201143.0
150,UNIVERSIDADE NOVE DE JULHO,UNINOVE,ASSOCIACAO EDUCACIONAL NOVE DE JULHO,Privada,5,1,Rua Vergueiro,235,Liberdade,,1504001.0
151,UNIVERSIDADE BRASIL,,UNIVERSIDADE BRASIL,Privada,5,1,Rua Carolina Fonseca,584,ITAQUERA,,8230030.0
152,FACULDADE UNIDAS DE TATUI,FDT,CENTRO DE ENSINO TATUIENSE SOCIEDADE SIMPLES LTDA.,Privada,5,3,Rua Oracy Gomes,665,Centro,Térreo,18270600.0
153,UNIVERSIDADE PAULISTA,UNIP,ASSUPERO ENSINO SUPERIOR LTDA.,Privada,4,1,Avenida Torres de Oliveira,330,Jaguaré,,5347020.0
154,UNIVERSIDADE IGUAÇU,UNIG,ASSOCIACAO DE ENSINO SUPERIOR DE NOVA IGUACU,Privada,5,1,Avenida Abílio Augusto Távora,2134,Jardim Nova Era,,26275580.0
155,FACULDADE MACHADO SOBRINHO,FMS,FUNDACAO EDUCACIONAL MACHADO SOBRINHO,Privada,5,3,Rua Pedro Celeste,s/n,Cruzeiro do Sul,,36030140.0
156,CENTRO DE ENSINO SUPERIOR DE JUIZ DE FORA,CES/JF,ASSOCIACAO PROPAGADORA ESDEVA,Privada,5,3,Rua Halfeld,1179,Centro,Campus Academia de C,36016000.0
157,PONTIFÍCIA UNIVERSIDADE CATÓLICA DE MINAS GERAIS,PUC MINAS,SOCIEDADE MINEIRA DE CULTURA,Privada,5,1,Avenida Dom José Gaspar,500,Coração Eucarístico,,30535901.0
158,FACULDADE DE JOÃO PESSOA (SANTA EMÍLIA DO RODAT),,UNIESP S.A,Privada,5,3,Avenida Presidente Epitácio Pessoa,494 / 514,Torre,SEDE,58040000.0
159,CENTRO UNIVERSITÁRIO NEWTON PAIVA,NEWTON PAIVA,INSTITUTO CULTURAL NEWTON PAIVA FERREIRA LTDA,Privada,4,2,Rua José Cláudio de Rezende,80,Escoril,Reitoria,30494230.0
160,CENTRO UNIVERSITÁRIO UNA,UNA,BRASIL EDUCACAO S/A,Privada,4,2,Rua dos Aimorés,1.451,Lourdes,Campus Sede Aimorés,30140071.0
161,ESCOLA DE ENGENHARIA KENNEDY,EEK,FUNDACAO EDUCACIONAL MINAS GERAIS,Privada,5,3,Rua José Dias Vieira,46,Visconde do Rio Branco,,31535040.0
162,INSTITUTO SUPERIOR DE CIÊNCIAS APLICADAS - ISCA,ISCA,ASSOCIACAO LIMEIRENSE DE EDUCACAO ALIE,Privada,5,3,Rodovia Deputado Laércio Corte,3000,Chácara Vista da Graminha,CAIXA POSTAL 98,13482383.0
163,CENTRO UNIVERSITÁRIO DE BELO HORIZONTE,UNI-BH,IEDUC - INSTITUTO DE EDUCACAO E CULTURA S/A,Privada,4,2,Avenida Prof. Mário Werneck,1685,Estoril,Bloco B 1,30455610.0
